company_name,job_role,job_location,salary_lpa,skills,company_rating,standardized_job_role
Hireflex247 India,Backend Developer (Cloud) – Node.js & TypeScript,Bengaluru,5.5,"Node.js, Google Cloud Platform, Application development, Docker, Agile",5.0,Cloud Engineer
Check Point Software Technologies Ltd.,Cloud Backend Developer,Bengaluru,4.5,"Elasticsearch, OOP, AWS, Agile, Kafka",3.9,Cloud Engineer
Credy,"Backend Developer (Django, Python, Celery, AWS)",India,11.429259259259261,"Git, AWS, Machine learning, PostgreSQL, Redis",3.9,Cloud Engineer
[x]cube LABS,Cloud Penetration Tester,Hyderābād,5.5,"Penetration testing, Cloud infrastructure, Azure, Writing skills, Test automation",4.4,Cloud Engineer
MagicFinServ,Net + Kubernetes,Remote,8.748025247524753,"CI/CD, CSS, Kubernetes, Enterprise Software, .NET Core",0.0,Cloud Engineer
EnactOn Technologies,"Back-end Developer (Python, MongoDB, AWS)",Surat,4.5,"Elasticsearch, Node.js, Cassandra, React, Big data",4.5,Cloud Engineer
Empenofore Technologies,Cloud Developer,Gurgaon,10.0,"CI/CD, Azure, Node.js, Kubernetes, .NET Core",4.8,Cloud Engineer
Ajmera Infotech,Senior Azure DevOps Engineer (IaaS),Telangana,7.558181818181819,"Jira, CI/CD, Cloud infrastructure, Azure, Kubernetes",4.3,Cloud Engineer
Zeta Global,Cloud FinOps Analyst,Bengaluru,17.272727272727273,"Cloud infrastructure, Presentation skills, Digital marketing, AI",3.5,Cloud Engineer
Novartis,"Senior Analyst, Marketing Cloud Intelligence",Hyderābād,5.0,"Power BI, Azure, Business intelligence, Salesforce, Alteryx",4.0,Cloud Engineer
Talenlio,Sr. Cloud/DevOps Engineer,Remote,17.5,"Cloud architecture, Business intelligence, Big data, Database design, AWS",0.0,Cloud Engineer
NTT DATA,Salesforce Marketing Cloud_Digital Solution Consultant Analyst,Hyderābād,16.90029411764706,"Salesforce Marketing Cloud, CSS, Salesforce, SOAP, SQL",3.8,Cloud Engineer
Covantech,Oracle Fusion Cloud HCM Payroll Analyst,Hyderābād,4.5,"Microsoft Powerpoint, Hyperion, Oracle, Cloud architecture, Business intelligence",3.6,Cloud Engineer
Google,"Vendor Solutions Consultant, Google Cloud",Hyderābād,7.558181818181819,"Google Cloud Platform, Project management, Proposal writing, Presentation skills, Technical project management",4.3,Cloud Engineer
Hirein5,AWS Cloud Engineer,Remote,13.0,"CI/CD, Cloud architecture, Software troubleshooting, Kubernetes, DevOps",0.0,Cloud Engineer
VIDEE INFOTECH,Cloud DevOps Engineer,Remote,8.748025247524753,"CI/CD, Cloud infrastructure, Azure, Bamboo, Kubernetes",0.0,Cloud Engineer
Instaacoders Technologies Pvt. Ltd.,Senior DevOps/ Cloud Engineer,Remote,31.5,"CI/CD, Performance tuning, Cloud infrastructure, System administration, Gradle",3.7,Cloud Engineer
Barclays,AWS Cloud Engineer,Pune,11.429259259259261,"AWS, Machine learning, S3, Redshift, DynamoDB",3.9,Cloud Engineer
Concentrix,Cloud Engineer,Hyderābād,12.577608695652176,"CI/CD, Cloud infrastructure, Software troubleshooting, Kubernetes, Ansible",4.0,Cloud Engineer
"Arch Systems, LLC",AWS Cloud Engineer - India,Remote,16.5,"Drupal, System administration, FedRAMP, WordPress, DevOps",4.2,Cloud Engineer
InfoTech Solutions Pvt Ltd,Cloud Engineer,Bengaluru,7.5,"CI/CD, Cloud infrastructure, Azure, Cloud architecture, Software troubleshooting",4.3,Cloud Engineer
Value Point Systems,Cloud Trainee Engineer,Noida,11.944444444444445,"CI/CD, Azure, Operating systems, Software troubleshooting, Kubernetes",3.7,Cloud Engineer
Albireo Tech System,Cloud Engineer,Remote,15.84,"CI/CD, Azure, SQL, Continuous integration, Python",3.6,Cloud Engineer
MAI,Azure Cloud Engineer,Remote,5.88,"Azure, Software troubleshooting, Kubernetes, SQL, Terraform",0.0,Cloud Engineer
Astracloud,AWS DevOps Engineer,Remote,9.0,"Jira, CI/CD, Cloud infrastructure, Kubernetes, Ansible",0.0,Cloud Engineer
Ataloud Technologies,AWS Cloud Engineer,Remote,9.299130434782608,"CI/CD, Cloud infrastructure, Operating systems, Kubernetes, Load balancing",4.1,Cloud Engineer
Digital Innovations,AWS Cloud Engineer,Remote,8.748025247524753,"Cloud infrastructure, Kubernetes, DevOps, Configuration management, AWS",0.0,Cloud Engineer
Semperfi Solution,MICROSOFT OFFICE 365 CLOUD ENGINEER,Remote,12.5,"PaaS, Microsoft Office",0.0,Cloud Engineer
Paypal,Cloud Engineer,Chennai,11.944444444444445,"Cloud infrastructure, Azure, Cloud architecture, Kubernetes, Ansible",3.7,Cloud Engineer
Boston Consulting Group,Global IT Infra/Cloud Engineer Senior Specialist,Gurgaon,7.558181818181819,"Jira, CI/CD, Azure, Customer service, DevOps",4.3,Cloud Engineer
GenexCorp,2. AWS Cloud Engineer,Telangana,8.748025247524753,AWS,0.0,Cloud Engineer
UltraViolet Cyber,Cloud Engineer,Hyderābād,11.429259259259261,"TCP, Cloud infrastructure, Kubernetes, Load balancing, DevOps",3.9,Cloud Engineer
ProntoDigital LLC,Enterprise Cloud Experience Engineer,Remote,12.48425,"Cloud infrastructure, Microsoft Office, Mobile device management, Identity & access management",0.0,Cloud Engineer
Futurism,AWS Cloud Engineer- Intern,India,11.429259259259261,"AWS, Perl, Scripting, DNS, APIs",3.9,Cloud Engineer
BigSpire Software,Associate Cloud Computing Engineer,India,11.429259259259261,"AWS, Cloud computing, Communication skills",3.9,Cloud Engineer
Apple,Junior Cloud Network Software Engineer - Platforms,Bengaluru,9.299130434782608,"Cloud infrastructure, Rust, Go, Data structures, AWS",4.1,Cloud Engineer
Workmates Core2cloud,AWS Cloud Engineer Trainee,Bhubaneshwar,7.666666666666667,"Network administration, AWS, Perl, Scripting, DNS",5.0,Cloud Engineer
Technology Next,Cloud Engineer,Remote,7.8,"CI/CD, Cloud infrastructure, Azure, Node.js, Kubernetes",0.0,Cloud Engineer
Hirein5,Azure Cloud Engineer,Remote,13.0,"CI/CD, Cloud infrastructure, Azure, Kubernetes, DevOps",0.0,Cloud Engineer
Yotta Infrastructure,Cloud Engineer,Delhi,12.577608695652176,"Cloud infrastructure, System administration, NFS, English, OpenStack",4.0,Cloud Engineer
Spiderweb technologies,DevOps/AWS Engineer,Remote,2.7,"CI/CD, Cloud infrastructure, Azure, Kubernetes, Ansible",0.0,Cloud Engineer
Hexagon AB,Cloud Ops Engineer,Hyderābād,9.299130434782608,"Cloud infrastructure, Azure, Encryption, AWS, Identity & access management",4.1,Cloud Engineer
Dwaith Infotech Pvt Ltd,Azure Cloud Engineer,Remote,6.0,"Power BI, Data modeling, Azure, Spark, SQL",0.0,Cloud Engineer
Alight,Cloud Operations Engineer,Hyderābād,6.333333333333333,"TCP, Cloud infrastructure, System administration, Azure, NFS",3.3,Cloud Engineer
NTT DATA,Private Cloud Engineer,Hyderābād,16.90029411764706,"Cloud infrastructure, System administration, Oracle, VMWare, Research & development",3.8,Cloud Engineer
Flentas Technologies,Cloud Engineer,Pune,7.1875,,4.5,Cloud Engineer
Vodafone,Cloud DevOps Engineer,Pune,6.5,"Jira, SAFe, Business intelligence, Git, Google Cloud Platform",3.9,Cloud Engineer
Technology Next,Cloud Engineer (GCP),Remote,9.6,"CI/CD, Cloud infrastructure, Cloud architecture, Kubernetes, Git",0.0,Cloud Engineer
Eduplex services private limited,Cloud Infrastructure Engineer,Remote,12.5,"CI/CD, Cloud infrastructure, Big data, Writing skills, DevOps",0.0,Cloud Engineer
Mobile Programming India Pvt. Ltd.,Azure Cloud Engineer,Remote,14.0,"CI/CD, Authentication, Cloud infrastructure, Azure, Cloud architecture",0.0,Cloud Engineer
HIRINGHOUSE TECHNOLOGIES PVT LTD,Private Cloud Engineer,Bengaluru,11.5,"Cloud infrastructure, Azure, Cloud architecture, Ansible, Git",0.0,Cloud Engineer
Destek Infosolutions pvt ltd,Cloud Engineer,Pune,4.0,"Azure, Software troubleshooting, Software deployment, Google Cloud Platform, Windows",0.0,Cloud Engineer
Flipkoins,AWS Cloud Engineer - Remote - Indian Timezone,Remote,6.833333333333333,"Ansible, AWS, Terraform, Puppet, Chef",4.7,Cloud Engineer
Cloud Kinetics,Cloud Engineer L1 - AWS,Chennai,16.90029411764706,"FTP, CI/CD, DevOps, LAN, Windows",3.8,Cloud Engineer
ACI Group,Cloud Engineer / IT Administrator,Bengaluru,11.30108695652174,"CI/CD, Cloud infrastructure, Azure, Ansible, DevOps",3.6,Cloud Engineer
"BimSym eBusiness Solutions, Inc",AWS Cloud Engineer,India,8.748025247524753,"Cloud architecture, Software deployment, AWS, APIs, IT",0.0,Cloud Engineer
KShiyaRise,Azure Cloud Engineer,Remote,21.0,"CI/CD, Cloud infrastructure, Azure, Cloud architecture, Kubernetes",0.0,Cloud Engineer
Lumel Technologies,Azure/Cloud Engineer,Chennai,7.1875,"TCP, Azure, Software troubleshooting, Scripting, Computer networking",4.5,Cloud Engineer
Primeindus Fintech Solutions||Indusspay,Cloud Engineer,Bengaluru,6.0,"CI/CD, Elasticsearch, Cloud infrastructure, Azure, Kubernetes",0.0,Cloud Engineer
Stack Console,Sr. Cloud Engineer,Remote,10.0,"OpenStack, VMWare, Apache",4.8,Cloud Engineer
CosMic IT,Cloud Engineer,Remote,3.0,"Azure, Cloud architecture, Research, AWS, Cloud development",2.5,Cloud Engineer
TechO2,AWS Cloud Engineer,Hyderābād,5.0,"CI/CD, Tomcat, NoSQL, Git, Databases",3.7,Cloud Engineer
EY,DE-AWS-Cloud Native Engineer-VG-GDSF02,Hyderābād,11.944444444444445,"CI/CD, Elasticsearch, Microsoft Access, Node.js, Software troubleshooting",3.7,Cloud Engineer
UMENIT SOLUTIONS LLP,Cloud Infra,Remote,12.0,"CI/CD, Cloud infrastructure, Azure, Cloud architecture, Kubernetes",0.0,Cloud Engineer
Indian Political Action Committee (I-PAC),Cloud Engineer,Hyderābād,6.15,"Cloud architecture, Node.js, NoSQL, MongoDB, SQL",2.9,Cloud Engineer
Apple,Cloud Solutions Engineer,Bengaluru,9.299130434782608,"CI/CD, Cloud infrastructure, Kubernetes, Ansible, DevOps",4.1,Cloud Engineer
Nagarro,"Associate Staff Engineer, Cloud",Remote,11.429259259259261,,3.9,Cloud Engineer
Helius Technologies,Cloud Engineer,India,19.756000000000004,"Windows, AWS, S3, Solution architecture, VPN",4.2,Cloud Engineer
Cloud 9 Infosystems,Jr Cloud Operations Engineer,India,5.333333333333333,"Cloud infrastructure, Azure, AWS, Analysis skills, Communication skills",4.6,Cloud Engineer
Brillium Tech Solutions,AWS Cloud Engineer,India,3.6,"CI/CD, Cloud infrastructure, Oracle, AWS, Continuous integration",0.0,Cloud Engineer
ANZ Banking Group,AWS Cloud Engineer,Bengaluru,11.429259259259261,"CI/CD, Go, System design, Git, Google Cloud Platform",3.9,Cloud Engineer
Nagarro,"Staff Engineer, Cloud",Remote,11.429259259259261,,3.9,Cloud Engineer
Barclays,Cloud DevOps Engineer,Pune,7.0,"Azure, DevOps, Git, Java, AWS",3.9,Cloud Engineer
KLX Cloud IT,Cloud DevOps Engineers,Remote,8.748025247524753,"Azure, Kubernetes, DevOps, PaaS, AWS",0.0,Cloud Engineer
REIZEND PRIVATE LIMITED,Cloud/DevOps Engineer (Experienced),India,20.5,"CI/CD, Cloud infrastructure, Kubernetes, Software deployment, DevOps",3.6,Cloud Engineer
OMFYS Technologies India Pvt Ltd,Cloud Engineer,India,5.0,"CI/CD, Azure, Oracle, PaaS, AWS",3.2,Cloud Engineer
Innominds Software,Cloud DevOps Engineer,Hyderābād,6.5,"Azure, Oracle, Go, Kubernetes, Ansible",3.9,Cloud Engineer
Renous Consulting,AWS Cloud Engineer,Bengaluru,7.2,"CI/CD, Node.js, Salesforce, ERP systems, Warehouse management system",0.0,Cloud Engineer
Nagarro,"Associate Principal Engineer, Cloud",Remote,11.429259259259261,"Azure, Cloud architecture, Google Cloud Platform, AWS, Cloud development",3.9,Cloud Engineer
Infor,Cloud System Engineer,Hyderābād,5.5,"CI/CD, Elasticsearch, NoSQL, Git, Java",4.0,Cloud Engineer
Akra Tech,Aws Cloud Administrator,Remote,9.299130434782608,"Cloud infrastructure, Kubernetes, DevOps, Encryption, AWS",4.1,Cloud Engineer
CIS,Trainee AWS Engineer,Indore,7.558181818181819,"Cloud infrastructure, Software troubleshooting, Encryption, AWS, Analysis skills",4.3,Cloud Engineer
Accenture,Cloud Platform Engineer,Hyderābād,16.90029411764706,"Cloud infrastructure, Azure, Software troubleshooting, Kubernetes, Ansible",3.8,Cloud Engineer
Basware,"Junior Associate Cloud Operations Engineer, PDF Mapping",Chandigarh,12.577608695652176,"Jira, XML, English, Windows, Microsoft Office",4.0,Cloud Engineer
HIRINGNINJA,AWS Cloud Engineer,Pune,17.5,"Cloud architecture, AWS, Cloud development, Terraform, Communication skills",4.1,Cloud Engineer
KPI Partners,Cloud Engineer,Hyderābād,11.944444444444445,"CI/CD, Cloud infrastructure, Azure, DevOps, Terraform",3.7,Cloud Engineer
Umbrella Infocare,AWS Cloud DevOps Engineer,Remote,11.429259259259261,"Elasticsearch, Internet of things, Kubernetes, Ansible, Software deployment",3.9,Cloud Engineer
Tivona Global Technologies,Cloud Engineer,Chennai,5.333333333333333,"Cloud infrastructure, System administration, Azure, Operating systems, Kubernetes",4.6,Cloud Engineer
Gainwell Technologies LLC,AWS Cloud Engineer,Bengaluru,6.0,"Microsoft Windows Server, Computer science, Azure, Ansible, Relational databases",3.1,Cloud Engineer
DAZN,Cloud Security Engineer,Hyderābād,8.0,"Azure, Go, Node.js, Kubernetes, Git",2.9,Cloud Engineer
Basware,Associate Cloud Operations Engineer,Chandigarh,12.577608695652176,AWS,4.0,Cloud Engineer
Aurum PropTech,Analyst - Cloud Engineer,Navi Mumbai,12.577608695652176,"Jira, CI/CD, Software troubleshooting, Kubernetes, AWS",4.0,Cloud Engineer
Xianinfotech LLP,Azure Cloud Engineer,Remote,1.8,"CI/CD, Cloud infrastructure, Azure, Kubernetes, DevOps",3.4,Cloud Engineer
Cloud 9 Infosystems,Cloud Engineer,India,5.333333333333333,"Microsoft Windows Server, Azure, Operating systems, Windows, Microsoft Office",4.6,Cloud Engineer
Route Mobile,AWS Cloud Engineer,Mumbai,12.577608695652176,"Elasticsearch, DevOps, PaaS, AWS, Scripting",4.0,Cloud Engineer
TechBrein Solutions PVT LTD,Cloud DevOps Engineer,India,5.5,"CI/CD, Cloud infrastructure, Microsoft Access, Azure, Ansible",4.5,Cloud Engineer
TotHR Solutions,AWS Cloud Engineer,Cochin,7.5,"CI/CD, Cloud infrastructure, Cloud architecture, Software troubleshooting, Kubernetes",5.0,Cloud Engineer
NetApp,Principal Software Engineer (Cloud),Bengaluru,5.5,"Cloud infrastructure, Azure, Go, Node.js, Kubernetes",4.1,Cloud Engineer
Athena Global Technologies,Cloud Engineer,Hyderābād,11.429259259259261,"NoSQL, Git, SQL, AWS, GitHub",3.9,Cloud Engineer
HRBRO PLACEMENT SERVICES,Cloud Engineer,Cochin,10.0,"CI/CD, Cloud infrastructure, Azure, Software troubleshooting, Kubernetes",4.0,Cloud Engineer
Aganitha AI,DevOps & Cloud Engineer,Hyderābād,11.429259259259261,"CI/CD, Go, Node.js, Kubernetes, DevOps",3.9,Cloud Engineer
WellnessLiving,AWS Cloud Engineer,Bengaluru,16.90029411764706,"CI/CD, Data modeling, Cloud infrastructure, Software deployment, Encryption",3.8,Cloud Engineer
EY,AWS Cloud Platform Engineer,Noida,4.5,"CI/CD, Cloud infrastructure, Ansible, Git, AWS",3.7,Cloud Engineer
Recruise,1700_ HPC Cloud Engineer,Bengaluru,6.833333333333333,"DevOps, R, Configuration management, Git, Research",4.7,Cloud Engineer
BiCSoM Technologies,Associate Cloud Engineer – Google Cloud Platform,Bengaluru,12.577608695652176,"CI/CD, Cloud infrastructure, Azure, Software troubleshooting, Kubernetes",4.0,Cloud Engineer
Arosys Technologies P Ltd,Cloud Engineer,Bhilai,3.9,"CI/CD, Cloud infrastructure, System administration, Kubernetes, Ansible",0.0,Cloud Engineer
PayPal,Cloud Platform Engineer,Chennai,6.0,"CI/CD, Cloud infrastructure, Software troubleshooting, Kubernetes, Ansible",3.7,Cloud Engineer
NetApp,Principal Software Engineer (Cloud Security),Bengaluru,5.5,"Cloud infrastructure, Azure, Go, Node.js, Kubernetes",4.1,Cloud Engineer
Optivisio Infotech Pvt Ltd,Sr. Cloud/DevOps Engineer,Remote,6.0,"CI/CD, Node.js, React, DevOps, PaaS",0.0,Cloud Engineer
Rackspace,Cloud Practice Engineer,Bengaluru,17.272727272727273,"CI/CD, Cloud infrastructure, Cloud architecture, PCI, DevOps",3.5,Cloud Engineer
Virtusa,AWS Cloud DevOps Engineer,Chennai,4.5,"Jira, AWS, Confluence, Agile",3.7,Cloud Engineer
Creencia Technologies Private Limited,Cloud Engineer/Specialist - Devops,Mumbai,12.0,"Cloud infrastructure, DevOps, Microsoft SQL Server, PaaS, Build automation",0.0,Cloud Engineer
SAP,Cloud Performance Engineer - Performance and Scalability Testing | 3-7 y,Bengaluru,7.5,"Node.js, Kubernetes, SAP, ERP systems, Docker",4.2,Cloud Engineer
NOYCE,Cloud Computing in AWS or Microsoft azure,India,4.2,"CI/CD, Cloud infrastructure, Azure, Cloud architecture, DevOps",0.0,Cloud Engineer
UMENIT SOLUTIONS LLP,Azure DevOps Engineer,Remote,15.5,"CI/CD, Elasticsearch, Azure, Kubernetes, Git",0.0,Cloud Engineer
Jinendra infotech pvt ltd.,Cloud Engineer(Private cloud),Remote,12.0,"TCP, Cloud infrastructure, System administration, Operating systems, Oracle",0.0,Cloud Engineer
Creencia Technologies Private Limited,Cloud Engineer Devops- GCP,India,9.5,"Cloud infrastructure, PaaS, Build automation, Terraform, IaaS",4.5,Cloud Engineer
Deutsche Bank,Google-Cloud Engineer,Pune,12.577608695652176,"Pentaho, Big data, Spark, Test-driven development, Apache Hive",4.0,Cloud Engineer
HiringGo,Azure Cloud Engineer,Delhi,12.0,"CI/CD, Cloud infrastructure, Azure, Software troubleshooting, Kubernetes",0.0,Cloud Engineer
EVERSANA,Public Cloud Platform Engineer,Pune,6.0,"Cloud infrastructure, Azure, PaaS, Git, AWS",3.5,Cloud Engineer
42 Gears Mobility Systems,Cloud Engineer,Bengaluru,9.299130434782608,"TCP, Operating systems, Software troubleshooting, Kubernetes, Load balancing",4.1,Cloud Engineer
Ciel HR Services Pvt Ltd,L2 cloud Engineer,Navi Mumbai,10.0,"Azure, Software deployment, Business development, AWS, Banking",4.0,Cloud Engineer
Paxcom India,AWS Cloud Engineer,Bengaluru,7.558181818181819,"System administration, Software troubleshooting, Software deployment, Disaster recovery, AWS",4.3,Cloud Engineer
Oracle,Oracle Cloud Operation Engineer,Bengaluru,16.90029411764706,"CI/CD, Oracle, Kubernetes, Disaster recovery, Git",3.8,Cloud Engineer
Betaque,Cloud Engineer,Indore,7.666666666666667,"Azure, Cloud architecture, NoSQL, SQL, AWS",5.0,Cloud Engineer
NICE Systems,Cloud Transformation Engineer,Pune,7.558181818181819,"Performance tuning, Oracle, Tomcat, Microsoft SQL Server, Windows",4.3,Cloud Engineer
TechGyan,Cloud Customer Engineer,India,11.429259259259261,"Azure, English, Microsoft Office, Presentation skills, SharePoint",3.9,Cloud Engineer
CGI,Cloud Engineer - Middleware,Mumbai,16.90029411764706,"Azure, Kubernetes, Ansible, AWS, Docker",3.8,Cloud Engineer
Cybrisk Tech Pvt Ltd,Cloud Engineer,India,3.48,"TensorFlow, CI/CD, Cloud infrastructure, Azure, Kubernetes",0.0,Cloud Engineer
Appex Innovation,Cloud Infrastructure Engineer,Mumbai,5.0,"CI/CD, Cloud infrastructure, Azure, Load balancing, Tomcat",3.8,Cloud Engineer
Dicetek LLC,Cloud DevOps Engineer,Gurgaon,7.5,"CI/CD, Elasticsearch, Cloud infrastructure, Azure, Kubernetes",4.3,Cloud Engineer
Akana Services Private Limited,Windows 365 Cloud Engineer,Pune,12.0,"PaaS, Windows, Virtualization, IaaS",0.0,Cloud Engineer
Unisys,Cloud Engineer,Bengaluru,11.30108695652174,"Microsoft Windows Server, FTP, Performance tuning, Cloud infrastructure, Azure",3.6,Cloud Engineer
APPNEURAL Pvt. Ltd.,Azure DevOps Engineer,Remote,9.0,"CI/CD, Cloud infrastructure, Azure, Kubernetes, Ansible",0.0,Cloud Engineer
ITEOS,GCP Cloud Engineer,Bengaluru,14.5,"Cloud infrastructure, Google Cloud Platform",0.0,Cloud Engineer
Experian,Cloud Platform Engineer,Hyderābād,5.0,"CI/CD, Cloud infrastructure, System administration, Azure, Node.js",4.2,Cloud Engineer
Solwyz Technologies Pvt Ltd,Cloud DevOps Engineer,India,9.0,"CI/CD, Software troubleshooting, Kubernetes, Ansible, DevOps",0.0,Cloud Engineer
Roima intelligence India Pvt Ltd,Cloud Engineer,India,5.0,"Jira, Azure, Oracle, Windows, Product development",0.0,Cloud Engineer
Creative Synergies Group,Cloud DevOps Engineer,Bengaluru,8.5,"CI/CD, Cloud infrastructure, Azure, Software troubleshooting, Kubernetes",3.8,Cloud Engineer
TheMaverics Technologies,Azure Cloud Engineer,Pune,8.748025247524753,"System administration, Azure, Communication skills, VPN",0.0,Cloud Engineer
Rite Software Solutions & Services (IN),Cloud Engineer,Hyderābād,9.299130434782608,"Cloud infrastructure, Azure, XML, NoSQL, Java",4.1,Cloud Engineer
Baker Hughes,Cloud DevOps Engineer,Mumbai,11.429259259259261,"CI/CD, Cloud infrastructure, Azure, Cloud architecture, Node.js",3.9,Cloud Engineer
fifthnote,"Engineer II, Cloud Security",Remote,7.1875,"Computer science, Azure, Cloud architecture, Business intelligence, Software deployment",4.5,Cloud Engineer
Rosemallow technologies,Azure Cloud Engineer,Coimbatore,8.748025247524753,"Azure, Kubernetes, DevOps, RBAC, Docker",0.0,Cloud Engineer
BeyondKey,AWS Cloud Engineer,Indore,6.833333333333333,"Cloud infrastructure, Cloud architecture, AWS, Terraform, S3",4.7,Cloud Engineer
Landmark Group,Cloud Engineer OCI,Bengaluru,16.90029411764706,"Cloud infrastructure, Operating systems, Oracle, NFS, Firewall",3.8,Cloud Engineer
Dicetek LLC,Azure Cloud Operations Engineer (L2),Remote,7.558181818181819,"Cloud infrastructure, Azure, DevOps, SQL, AWS",4.3,Cloud Engineer
Model N,Cloud Operations Engineer,Hyderābād,11.944444444444445,"JBoss, Jira, TCP, Operating systems, Oracle",3.7,Cloud Engineer
Acute Informatics Pvt. Ltd,AWS Cloud Engineer,Gurgaon,9.5,"IIS, AWS, Scripting, APIs, S3",3.3,Cloud Engineer
Sourcing Solution Technologies,Opening - OCI Cloud Engineer - Onsite Bangalore,Bengaluru,12.0,"Cloud infrastructure, Operating systems, Oracle, NFS, Firewall",0.0,Cloud Engineer
Photon,AWS Cloud Database Engineer,Chennai,12.577608695652176,"Data modeling, AWS, Kafka, Identity & access management",4.0,Cloud Engineer
Rapyder Cloud Solutions,AWS Cloud engineer (Mumbai),Mumbai,12.577608695652176,"IIS, Big data, Tomcat, Windows, AWS",4.0,Cloud Engineer
Orient Technologies,Cloud Engineer + Windows L2,Mumbai,16.25,"Cloud infrastructure, System administration, Windows, AWS",3.2,Cloud Engineer
Insight Enterprises,Cloud Infrastructure Engineer II,Gurgaon,8.5,"Cloud infrastructure, Azure, Cloud architecture, Disaster recovery, PaaS",3.6,Cloud Engineer
Creencia Technologies,Cloud DevOps Engineer - GCP,Mumbai,9.5,"Cloud infrastructure, Microsoft SQL Server, PaaS, Google Cloud Platform, Build automation",0.0,Cloud Engineer
Applogiq,Cloud DevOps Engineer,Delhi,4.5,"CI/CD, Node.js, Kubernetes, DevOps, Git",4.6,Cloud Engineer
eGrove Systems Pvt. Ltd,AWS Cloud/DevOps Engineer,Madurai,3.5,"Cloud infrastructure, Configuration management, Git, AWS, Docker",0.0,Cloud Engineer
Citco,Senior Cloud Applications Engineer - AWS,Hyderābād,7.533333333333333,"CSS, C#, Disaster recovery, PaaS, .NET",3.4,Cloud Engineer
Accenture,Cloud Native Engineer,Hyderābād,16.90029411764706,"Azure, Kubernetes, Ansible, Application development, AWS",3.8,Cloud Engineer
"Opus Capital Markets Consultants, LLC",Senior IT Cloud Engineer,Mumbai,20.0,"Cloud infrastructure, Azure, Encryption, PaaS, Windows",3.6,Cloud Engineer
Credera India,"Senior Engineer, AWS Cloud",Hyderābād,11.944444444444445,"CI/CD, Cloud architecture, Software troubleshooting, DevOps, Git",3.7,Cloud Engineer
Technoxander,AWS Senior Devops Engineer,Remote,10.5,"Elasticsearch, Kubernetes, Ansible, Load balancing, DevOps",0.0,Cloud Engineer
Emorphis Technologies,Cloud Engineer,Indore,12.577608695652176,"CI/CD, Azure, Node.js, Kubernetes, Ansible",4.0,Cloud Engineer
Recruise,1700_LCCI - Cloud Engineer,Bengaluru,6.833333333333333,"CI/CD, Azure, Node.js, CSS, React",4.7,Cloud Engineer
Neosoft Technologies,Cloud Administrator,Mumbai,8.0,"CI/CD, Cloud infrastructure, Azure, Software troubleshooting, Kubernetes",3.6,Cloud Engineer
Zensar Technologies,Cloud DevOps Engineer - L2,India,11.429259259259261,"Microsoft Windows Server, Cloud infrastructure, Azure, PaaS, English",3.9,Cloud Engineer
Three Ess Computer Services (I) Pvt. Ltd.,Cloud Engineer,Mumbai,7.8,"Cloud infrastructure, Azure, PaaS, APIs",4.4,Cloud Engineer
SymphonyAI,Cloud-DevOps Engineer,Bengaluru,15.0,"CI/CD, Cloud infrastructure, Azure, Kubernetes, Ansible",3.5,Cloud Engineer
Accenture,Cloud Services Engineer,Hyderābād,16.90029411764706,"Cloud infrastructure, Python",3.8,Cloud Engineer
eTest Automations,Cloud Engineer,Bengaluru,8.748025247524753,"Big data, Spark, Data analysis skills, Apache Hive, J2EE",0.0,Cloud Engineer
Computronics System ( India) Pvt. Ltd,AWS Engineer,Bengaluru,7.0,"Software troubleshooting, Ansible, DevOps, AWS, Terraform",4.7,Cloud Engineer
SSquad Global,Azure Cloud Engineer,Bengaluru,25.2,"CI/CD, TCP, Cloud infrastructure, Azure, Go",4.2,Cloud Engineer
DataTerrain India Pvt Ltd. (www.dataterrain.com),AWS Certified Cloud and System Engineer,Chennai,36.0,"Cloud architecture, Software troubleshooting, Software deployment, Disaster recovery, Microsoft SQL Server",3.9,Cloud Engineer
Pyramid Global Technologies,AWS Cloud Engineer,Mohali,7.666666666666667,"Azure, Software troubleshooting, Kubernetes, AWS, Docker",5.0,Cloud Engineer
Google,"Customer Engineer, AI Infrastructure, Google Cloud",Gurgaon,7.558181818181819,"TensorFlow, Cloud infrastructure, Cloud architecture, Google Cloud Platform, Machine learning",4.3,Cloud Engineer
IOSys Software India Private Limited,Azure DevOps Engineer,Remote,17.0,"CI/CD, ASP.NET, Azure, Kubernetes, DevOps",0.0,Cloud Engineer
Progress,Cloud Network Engineer Senior,Hyderābād,4.5,"Data center experience, Cloud infrastructure, Azure, Ansible, Software deployment",4.0,Cloud Engineer
Optum,Software Engineer - Cloud,Gurgaon,17.272727272727273,"CI/CD, Cloud infrastructure, Azure, Cloud architecture, Kubernetes",3.5,Cloud Engineer
Providence Global Center,Principal Cloud Engineer,Hyderābād,17.272727272727273,"Cloud infrastructure, Azure, Cloud architecture, Kubernetes, Google Cloud Platform",3.5,Cloud Engineer
ATC,Cloud DevOps Engineer,Chennai,5.0,"CI/CD, Cloud infrastructure, Azure, Bamboo, Windows",4.3,Cloud Engineer
Blazeclan Technologies,Cloud Engineer - AWS DevOps,Bengaluru,16.90029411764706,"CI/CD, Cloud infrastructure, Go, Kubernetes, DevOps",3.8,Cloud Engineer
Design Nation,Cloud Engineer,Hyderābād,6.0,,3.1,Cloud Engineer
Nagarro,"Principal Engineer, Cloud Infrastructure",Remote,11.429259259259261,Cloud infrastructure,3.9,Cloud Engineer
