company_name,job_role,job_location,salary_lpa,skills,company_rating,standardized_job_role
Pacer Automation Pvt Ltd,Desktop Support Engineer,India,3.6,"Desktop support, Operating systems, Windows, Microsoft Office, IT support",0.0,Support Engineer
Etrans Solutions,Project Coordinator and Customer Support Liaison (CSD – IT),Calcutta,24.0,"Project coordination, Analysis skills, Project management, Project management methodology, Customer support",3.9,Support Engineer
LinguaSol,Technical Support Executive,Pune,6.0,"Technical support, Software testing, Communication skills",5.0,Support Engineer
Corbion,Technical Support Specialist - Industrial Bakery,Mumbai,4.5,"Microsoft Powerpoint, Microsoft Word, Microsoft Excel, Baking, English",3.4,Support Engineer
Novisync,Technical Support Specialists,Visakhapatnam,6.0,"Software troubleshooting, Customer service, Technical support, Communication skills",3.4,Support Engineer
BMC Software,Staff Specialist Technical Support Analyst,Pune,7.0,"Operating systems, English, Technical support, Scripting, Software development",3.9,Support Engineer
ThinkPalm Technologies,Technical Support Executive,Thiruvananthapuram,6.0,"System administration, Technical support, Docker, Virtualization, VMWare",4.1,Support Engineer
KocharTech,Desktop Support Engineer,Calcutta,48.0,"Software troubleshooting, Process improvement",4.0,Support Engineer
Signals & Systems (India),Jr. Engineer - Technical Support,Chennai,42.0,"Technical support, Microsoft Office, Product demos, Communication skills",4.2,Support Engineer
Clove Dental,Desktop Support Engineer,Noida,4.8,"Network installation, Software troubleshooting, Windows, Computer networking, Linux",3.7,Support Engineer
ioNob,Software Technical Support Executive,Calicut,2.0,"Desktop support, Software troubleshooting, Customer service, Technical support, Computer networking",0.0,Support Engineer
NSPIRA Management Services,Customer support Executive- IT support,Hyderābād,30.0,"Telugu, Bengali, English, Tamil, Kannada",3.8,Support Engineer
Befisc,Technical Support Specialist,Noida,4.073035714285714,"XML, Customer service, Technical support, Scripting, APIs",0.0,Support Engineer
Biorev LLC,Technical Support Executive,Mohali,7.5,"English, Technical support, Microsoft Office, ServiceNow",0.0,Support Engineer
Network Techlab (India) Pvt. Ltd,Engineer Technical Support L2,Mumbai,42.0,"OSPF, English, Technical support, BGP, Routing protocols",3.8,Support Engineer
Kapture,Technical Support Executive(Freshers),Bengaluru,48.0,"Jira, Customer service, Technical support, Microsoft Office, Analysis skills",3.5,Support Engineer
ADVANCELLS GROUP,IT Support Specialist,Noida,4.073035714285714,"Operating systems, Software troubleshooting, IT support, Communication skills",0.0,Support Engineer
GRABWEB MANAGED HOSTING,Technical Support (WEB HOSTING),Panchkula,1.8,"English, Technical support, Microsoft Office, ServiceNow, Hindi",0.0,Support Engineer
Hex Business Innovations,IT Technical Support Engineer,Farīdābād,1.62,"Software troubleshooting, Technical support, Microsoft Office, ServiceNow",0.0,Support Engineer
Paypal,Global Technical Support Engineer 1,Chennai,5.0,"Oracle, Software troubleshooting, Technical support, Microservices, SQL",3.7,Support Engineer
ConnectWise,Technical Support Specialist II,Mumbai,5.0,"Microsoft Windows Server, Operating systems, Software troubleshooting, Windows, Technical support",3.5,Support Engineer
Helo,Technical Support,Mumbai,12.0,"Technical support, Communication skills, HTML, MySQL",4.7,Support Engineer
Codelattice Digital Solutions Pvt.Ltd,Technical Support - Fresher,Calicut,6.0,"Node.js, Software troubleshooting, Customer service, English, Technical support",4.7,Support Engineer
Inaho Digital Solutions Private Limited,IT Support Engineer - Bilingual,Chennai,2.5,"Microsoft Windows Server, Jira, Bilingual, TCP, System administration",0.0,Support Engineer
Zouma,Technical Support Executive,Mohali,4.5,"English, Technical support, Microsoft Office, ServiceNow",0.0,Support Engineer
CludoBits IT Solutions,Technical Support Manager,Pune,3.0,"Microsoft Windows Server, Windows, Technical support, Firewall, DHCP",0.0,Support Engineer
Hiranandani Group,L1 Desktop Support Engineer,India,1.2,"Desktop support, Software troubleshooting, Windows, Communication skills",0.0,Support Engineer
SPM Enterprise,Desktop Support Engineer,Hyderābād,12.0,"Desktop support, Operating systems, Software troubleshooting, English, Microsoft Office",0.0,Support Engineer
NetEx Technologies,Technical Support Specialist (Remote Position),Nawāshahr,1.62,"Desktop support, Azure, Software troubleshooting, Customer service, English",0.0,Support Engineer
Infoicon Technologies,TECHNICAL SUPPORT ENGINEER,Noida,30.0,Technical support,4.3,Support Engineer
GD Goenka Healthcare Pvt Ltd,Technical Support Manager,Delhi,6.3,"Management, IT management, Software troubleshooting, LAN, Technical support",0.0,Support Engineer
Spintly India Private Limited,Technical Support Engineer,Bengaluru,21.6,"Computer science, Software troubleshooting, Technical support, Analysis skills, Scripting",4.1,Support Engineer
"Tech Brains Solutions, Inc.","Technical Support Analyst, ERP Systems",Pune,13.5,"Software troubleshooting, Customer service, ERP systems, Microsoft SQL Server, SSRS",2.1,Support Engineer
V2 Solutions,Technical Support Engineer,Navi Mumbai,5.0,"Microsoft Powerpoint, Microsoft Word, TCP, Internet of things, Software deployment",0.0,Support Engineer
Grid Logic Software Private Limited,Technical Support,Hyderābād,4.5,"Technical support, Communication skills",4.8,Support Engineer
Seltam Technologies,Technical Support Associate,Chennai,3.5,"English, Technical support, Computer networking",2.1,Support Engineer
Zeblaze Solutions,Technical Support Executive,India,3.48,"English, Technical support, Microsoft Office, Hindi",0.0,Support Engineer
Gridlogic,Technical Support,Hyderābād,4.5,"Technical support, Communication skills",4.8,Support Engineer
Mind map IT Solutions,IT Technical Support Associate,Mohali,4.073035714285714,"Technical support, System security",0.0,Support Engineer
ORIENTAL COMPRESSOR ACCESSORIES PVT LTD,Technical Support Executive,India,3.0,"Mechanical engineering, English, Technical support, Microsoft Office, Quality assurance",0.0,Support Engineer
Pioneer HRS,Technical Support Executive,Pune,3.5,"English, Technical support, Microsoft Office, ServiceNow",0.0,Support Engineer
Seltam Technologies,International Non-Voice : Technical/Customer support.,Chennai,3.0,"English, Technical support, Communication skills",2.1,Support Engineer
Xerox,Technical Support Specialist,Cochin,3.5,"Microsoft Windows Server, Email marketing, CSS, Software troubleshooting, Customer service",3.3,Support Engineer
Caresoft Technologies,Desktop Support Engineer,India,2.04,"Desktop support, Field service, Microsoft Office, Computer hardware, ServiceNow",0.0,Support Engineer
Mind map IT Solutions,Technical Support Specialist US Process,India,4.0,"Operating systems, Technical support, Microsoft Office, Computer networking, ServiceNow",0.0,Support Engineer
Alphawizz Technologies Pvt. Ltd.,IT Support Engineer,India,1.8,"Cloud infrastructure, Azure, Software troubleshooting, Google Cloud Platform, Windows",0.0,Support Engineer
Vitely Corp Pvt Ltd,IT Support Engineer- Compliance,India,3.6,"Network administration, Cloud infrastructure, Clinical research, LAN, Firewall",0.0,Support Engineer
QServe IT Solutions,Technical Support Specialist,Tiruchchirāppalli,2.1,"Network installation, Software troubleshooting, LAN, Microsoft Exchange, Windows",0.0,Support Engineer
Grapes Innovative Solutions,Technical Support Quality Engineer,India,5.4,"Software troubleshooting, English, Technical support, Analysis skills, Database management",0.0,Support Engineer
Prestige Track Private Limited,Desktop Support Engineer,India,2.22,"Software troubleshooting, English, Microsoft Office, IT support, ServiceNow",0.0,Support Engineer
Bharja Technologies,Technical Support Specialist,Ahmedabad,4.5,"Jira, Desktop support, Telephony, System administration, Software troubleshooting",3.0,Support Engineer
Tikona Infinet,Technical Support Executive,India,4.533333333333333,"Technical support, Communication skills",3.4,Support Engineer
Ginger Technologies,Technical Support Engineer,Thrissur,3.0,"Customer service, Technical support, Communication skills",0.0,Support Engineer
TELUS Digital -,Technical Support Representative(International BPO),Noida,30.0,"Software troubleshooting, Technical support, Communication skills",3.6,Support Engineer
Optim Hire (LAD Software Solutions Pvt LTd),"Technical Support Executive (2-3 years, Pune, 8 LPA, Night Shift)",Pune,5.0,"TCP, Azure, Windows, Technical support, Virtualization",3.6,Support Engineer
Logictech Solutions,Technical Support Exec.,Delhi,1.5,Technical support,1.0,Support Engineer
Internetever,IT Support Engineer,Thrissur,18.0,"FTP, Software troubleshooting, Web development, English, Technical support",3.5,Support Engineer
Saini Electrical & Engineering Works Pvt. Ltd,Desktop Support Engineer,Thāne,2.7,"Desktop support, TCP, Operating systems, Windows, DHCP",0.0,Support Engineer
Masys Group,Technical Support Executive,Dombivli,4.073035714285714,"Software troubleshooting, English, Technical support, Microsoft Office, ServiceNow",0.0,Support Engineer
Oracle,"Technical Analyst 4 - OIM, OAM, OUD, OID - Support",India,20.791818181818183,"Oracle, Analysis skills",3.8,Support Engineer
CORPORATE INFOTECH PVT. LTD,Desktop Support Engineer,kāraikāl,2.64,"Oracle, SAP, Microsoft Office, IT support",0.0,Support Engineer
Degreed,"Technical Product Support Engineer | Hybrid | Bengaluru, India",Bengaluru,5.5,"FTP, Software troubleshooting, Process improvement, Technical support, APIs",3.4,Support Engineer
Whizlabs,Cloud Technical Support,Coimbatore,2.5,"Azure, Customer service, Google Cloud Platform, Technical support, AWS",0.0,Support Engineer
Sensys Technologies Pvt. Ltd,Technical Support Executive,India,2.1,"Microsoft Excel, English, Technical support, Microsoft Office, ServiceNow",0.0,Support Engineer
Upwork,M365 Technical Support Specialist,Delhi,21.461904761904762,"LAN, Windows, Technical support",3.9,Support Engineer
Test Private limited,IT Support Engineer,Bengaluru,1.32,"Network management, Computer networking",0.0,Support Engineer
MicroWorld Software Services Pvt. Ltd,IT Support Engineer (Security Focus),India,3.0,"TCP, Operating systems, Windows, Technical support, Analysis skills",2.9,Support Engineer
HANEUL SYSNET TECHNOLOGIES INDIA PVT LTD,Desktop Support Engineer,India,1.5,"Google Suite, Operating systems, Software troubleshooting, Windows, Microsoft Office",0.0,Support Engineer
BEACON India,Technical Support Engineer,Bengaluru,4.5,Technical support,4.0,Support Engineer
Mitsogo,Technical Support Engineer,Chennai,5.5,"Live chat, Customer service, Salesforce, iOS, Windows",3.6,Support Engineer
Codezen Tech Solutions,Technical Support Executive,Raipur,3.0,"Software troubleshooting, English, Technical support, Customer support, Communication skills",0.0,Support Engineer
Minitek Systems India pvt ltd,Desktop Support Engineer,Bengaluru,24.48,"LAN, Windows, Microsoft Office, ServiceNow",4.5,Support Engineer
Madras Medical college,Project Technical Support I,India,4.073035714285714,"Microsoft Powerpoint, Microsoft Word, Microsoft Excel, English, Research",0.0,Support Engineer
Three Ess Computer Services (I) Pvt. Ltd.,Desktop Support Engineer,India,30.24,"TCP, Software troubleshooting, LAN, Windows, Remote access software",4.4,Support Engineer
MAGNAMAS INFOTECH,IT Support Engineer,India,1.2,"Desktop support, Microsoft Outlook, Software troubleshooting, CCTV, Microsoft Office",0.0,Support Engineer
Momentus Technologies,Technical Support Specialist,Mumbai,48.0,"Crystal Reports, Software troubleshooting, Visual Studio, C#, Technical support",3.7,Support Engineer
Genesis HR Services,Technical Support Agent,Pune,5.0,"English, Technical support, DNS, ServiceNow, Communication skills",0.0,Support Engineer
Mahaveer Computers,IT Support Engineer,Bengaluru,3.18,"Software troubleshooting, LAN, Driving, Kannada",0.0,Support Engineer
THE RRKS,Desktop Support Engineer,Mumbai,2.1,"IT management, Software troubleshooting, Microsoft Office, Firewall",0.0,Support Engineer
cmts,Desktop Support Engineer,Punjab,13.571428571428571,"CCTV, LAN",4.2,Support Engineer
Zinier,Global Technical Support Manager,Bengaluru,6.0,"Operating systems, Technical support, Analysis skills, Leadership, Communication skills",4.2,Support Engineer
ZOUMA PVT LTD.,Technical Support Executive,Mohali,3.9,"Microsoft Outlook, Software troubleshooting, English, Technical support, SharePoint",0.0,Support Engineer
ServiceNow,Technical Support Engineer - OS & Network,Hyderābād,9.0,"FTP, SFTP, TCP, Azure, Software troubleshooting",4.4,Support Engineer
Ami Polymer Pvt. Ltd,IT Helpdesk Engineer,Silvassa,18.0,"Software troubleshooting, Microsoft Office, ServiceNow, Help desk",4.3,Support Engineer
Grapes Innovative Solutions,Technical Support Engineer,India,4.2,"Operating systems, Windows, Technical support, Databases, SQL",0.0,Support Engineer
Total IT Global,Desktop Support Engineer L1,Gurgaon,39.6,"Desktop support, Operating systems, Software troubleshooting, SCCM, Customer service",4.0,Support Engineer
Grassdoor Logistics Technologies Pvt Ltd,Technical Support Executive,Goa,4.073035714285714,"Customer service, Call center, English, Technical support, Customer support",0.0,Support Engineer
Hi-tech Applicator,IT Support Engineer,Ahmedabad,3.3,"Microsoft Windows Server, CCTV, LAN, Disaster recovery, Windows",0.0,Support Engineer
Variman Global Enterprises,Network Support Engineers,Hyderābād,48.0,"LAN, Information security, Firewall, IDS, Linux",4.0,Support Engineer
Allied digital service limited,Desktop Support Engineer,India,3.5,,0.0,Support Engineer
Mobicule Technologies,Technical Support,Mumbai,4.0,"Oracle, Software troubleshooting, English, Windows, Technical support",3.4,Support Engineer
The Cigna Group,Technical Support Analyst,Bengaluru,5.0,"Jira, Microsoft SQL Server, Technical support, SQL, Analysis skills",3.6,Support Engineer
Violet Infosystems Private Limited,Senior Technical Support Engineer,India,8.5,"Microsoft Excel, Software troubleshooting, English, Technical support, SQL",0.0,Support Engineer
Amphenol Omniconnect India Pvt Ltd,Technical Support Executive,Chennai,2.94,"Customer service, Technical support, Tamil",3.3,Support Engineer
Warrior tech solutions,Network Support Engineer,Chennai,7.5,"LAN, Microsoft Office, Network support, ServiceNow, Cisco routers",0.0,Support Engineer
Next Education,Technical Support Engineer,India,20.89470588235294,"Technical support, Computer networking, Communication skills",3.5,Support Engineer
Konverge Technologies Pvt Ltd India,Desktop Support engineer,Bengaluru,6.0,,3.8,Support Engineer
ANS TECZSERVE PVT LTD,Technical Support Executive,India,2.4,"English, Technical support, Microsoft Office, ServiceNow",0.0,Support Engineer
Mind map IT Solutions,Technical Support Specialist,Dera Bassi,4.073035714285714,"Desktop support, Software troubleshooting, Windows, Technical support, Remote access software",0.0,Support Engineer
SynapseIndia,Sr. IT Support Engineer,Noida,42.0,"FTP, Microsoft Outlook, iOS, LAN, Microsoft Exchange",3.8,Support Engineer
SupportHub360,L3 IT support engineer,Cochin,36.0,"Microsoft Windows Server, Azure, English, Microsoft Office, Firewall",5.0,Support Engineer
Rama Hospital and Research Center,IT Support Engineer,Noida,0.6,,0.0,Support Engineer
IDBI Intech,Management Trainee / Executive-Finacle Technical Support,Chennai,4.0,"Technical support, Project management",3.4,Support Engineer
Wolters Kluwer,IT Support Engineer III (Service Now),Chennai,7.0,"Customer service, Research, Analysis skills, Project management, ITIL",3.7,Support Engineer
Minitek Systems India pvt ltd,Technical Support,India,27.36,"English, Technical support, Microsoft Office, ServiceNow",4.5,Support Engineer
DispatchTrack,Technical Support Analyst,Hyderābād,20.89470588235294,"Management, XML, Customer service, English, Technical support",3.5,Support Engineer
VCEFE Tech Company,Technical Support Executive (IT),Tirunelveli,0.48,"CRM software, Customer service, English, Technical support, Microsoft Office",0.0,Support Engineer
PAKIZA GROUP,Network Support Engineer,India,1.2,"Software troubleshooting, Microsoft Office, Firewall, ServiceNow",0.0,Support Engineer
Papaya Global,Technical Support Engineer,Bengaluru,5.0,"English, Technical support, B2B, Application support",2.9,Support Engineer
Codebucket Solutions Private Limited,Technical Support Associate,India,1.98,"Software troubleshooting, Technical support, Communication skills",0.0,Support Engineer
Phykon,Technical Support Specialist (Voice Process - US Region),Thiruvananthapuram,42.0,"LAN, English, Technical support, WAN, Communication skills",3.9,Support Engineer
Biorev Technology,Technical Support Agent,Mohali,4.5,"English, Technical support, Microsoft Office, Remote access software, SharePoint",0.0,Support Engineer
PPN Solutions Pvt Ltd,IT Support Engineer,India,3.6,"Operating systems, English, Databases, Communication skills, Active Directory",0.0,Support Engineer
NFINITY GLOBAL,Regional IT Support Engineer,Gurgaon,4.5,"Authentication, Software troubleshooting, SCCM, Remedy, Customer service",5.0,Support Engineer
BMC Software,Technical Support Analyst,Pune,7.0,"TCP, Azure, Ansible, OSPF, Google Cloud Platform",3.9,Support Engineer
Docsvault,IT Software Support Engineer,Vadodara,48.0,"ASP.NET, Software troubleshooting, English, SQL, Application support",4.2,Support Engineer
Eagle Eye Networks Inc,Technical Support Representative - L1A,Bengaluru,4.5,"Business intelligence, Technical support, Computer networking, Network architecture, APIs",3.1,Support Engineer
Innometrics Software Pvt Ltd,Technical Support Specialist,Noida,3.6,"Microsoft Outlook, Software troubleshooting, Technical support, Communication skills, Time management",0.0,Support Engineer
Ankur Web Technology,Technical Support Representative,Allahabad,5.0,Technical support,0.0,Support Engineer
Innvocon,Technical Support Engineer (L2),Noida,6.0,"Jira, XML, Multilingual, Data structures, J2EE",5.0,Support Engineer
BLUEBOX INFOSOFT PVT LTD,IT Support Engineer,India,2.7,"Microsoft Windows Server, Desktop support, TCP, Software troubleshooting, IIS",0.0,Support Engineer
Botree Software International Pvt Ltd,Technical Support (Hindi Language),Chennai,3.0,"Customer service, English, Technical support, SQL, Tamil",0.0,Support Engineer
Trdez Investment Pvt. Ltd.,Desktop Support Engineer,Pune,2.28,"Desktop support, Power BI, Software troubleshooting, Data analytics, Python",0.0,Support Engineer
Cimcon Automation,Technical Support/ Implementation Engineers,India,13.993444444444446,"English, Technical support",3.6,Support Engineer
OA Compserve Pvt.Ltd,IT Field Support Engineer,India,2.7,"CCTV, LAN, Computer hardware, IT support, IP networking",0.0,Support Engineer
Kartik Enterprises,Desktop Support Engineer,India,3.0,"Desktop support, Software troubleshooting, English, Microsoft Office, Computer networking",0.0,Support Engineer
Open Text Corporation,Sr. Technical Support Specialist,Bengaluru,5.0,"Windows, Technical support, Analysis skills, Content creation, Linux",3.4,Support Engineer
ZM Technologies,Jr. technical Support,Pune,23.76,"Azure, Software troubleshooting, LAN, Technical support, Firewall",4.0,Support Engineer
Aspen Technology,Technical Support Engineer I,Pune,8.5,"Software troubleshooting, English, Technical support, Computer networking, Communication skills",3.2,Support Engineer
Jewels Infosystems,Desktop Support Engineer,Jaipur,1.5,"Microsoft SQL Server, Firewall, Computer hardware, Computer networking",1.0,Support Engineer
Veg Ease,IT Support Engineer,Noida,2.28,"Software troubleshooting, Warehouse management system, Windows, IT support, Linux",0.0,Support Engineer
Transoft Solutions,Tech Support Analyst,Bengaluru,5.5,"CRM software, AutoCAD, MicroStation, CAD, English",4.0,Support Engineer
Toshvi Computer Services,Desktop Support Engineer,Pune,5.0,"Desktop support, Microsoft Outlook, Software troubleshooting, Windows, Computer networking",0.0,Support Engineer
Secure service plus,"Fresher job for Technical Support Executive in electronic city, Bangalore",Bengaluru,12.0,"English, Technical support, Microsoft Office, SQL",0.0,Support Engineer
Acute Informatics Pvt. Ltd,Network Support Engineer,Mumbai,3.48,"OSPF, LAN, BGP, WAN, Computer networking",3.3,Support Engineer
NICE Systems,Specialist Technical Support Engineer,Pune,9.5,"Microsoft Windows Server, Elasticsearch, Azure, Customer service, Enterprise Software",4.3,Support Engineer
Altera Digital Health India,Technical Support Consultant - 1870,Pune,7.0,"Microsoft Windows Server, Software troubleshooting, IIS, English, Research",3.5,Support Engineer
ZS,Technical Support Associate,Pune,8.0,"Microsoft Outlook, Software troubleshooting, SCCM, Customer service, iOS",3.6,Support Engineer
Zebra Technologies,"Technical Customer Support, II",Pune,21.461904761904762,"Software troubleshooting, Customer service, Communication skills",3.9,Support Engineer
ITMantra,Desktop Support Engineer,Noida,5.5,"LAN, VoIP, DNS, IP networking",2.9,Support Engineer
Radiant Job,Network Support Engineer,Mumbai,7.0,"TCP, Software troubleshooting, Customer service, LAN, English",0.0,Support Engineer
Great Techno Tycoon,Jr. Technical Support Engineer,Indore,3.5,"Technical support, Communication skills",0.0,Support Engineer
Ciena,"Senior Associate, Global Technical Support",Gurgaon,8.0,"Microsoft Word, Computer science, Microsoft Excel, Microsoft Outlook, English",4.2,Support Engineer
Eltropy,Technical Support Specialist- Tier 2,Bengaluru,4.5,"Jira, Fiddler, SFTP, SSO, Technical support",4.0,Support Engineer
Dixit Infotech,Desktop Support Engineer,Bharūch,42.0,"Desktop support, Microsoft Outlook",4.0,Support Engineer
Upwork,595-Remote OneDrive Technical support Agent with M365 Skills,Delhi,21.461904761904762,"Software troubleshooting, LAN, English, Windows, Technical support",3.9,Support Engineer
"Red Hat, Inc.",Associate Technical Support Engineer,Pune,8.0,"Kubernetes, Customer service, Technical support, OS Kernels, Computer networking",4.2,Support Engineer
"AmvionLabs Pvt Ltd.,",Network Support Engineer,Chennai,3.0,"TCP, DHCP, Analysis skills, Network protocols, DNS",0.0,Support Engineer
Minitek Systems India pvt ltd,hardware Technical Support,India,27.36,"English, Technical support, Microsoft Office, ServiceNow",4.5,Support Engineer
Abiding Technology,IT Support Engineer,India,1.8,"TCP, Software troubleshooting, Windows, Microsoft Office, Computer networking",0.0,Support Engineer
Samsara,Technical Support Specialist,Bengaluru,20.89470588235294,"French, Computer science, Software troubleshooting, Technical support, GPS",3.5,Support Engineer
Fourth Dimension Technologies,Desktop Support Engineer,Chennai,30.0,"Software troubleshooting, DNS, Communication skills",4.3,Support Engineer
Hi Tech Informatics,Technical Support Engineer,Bengaluru,25.92,"Technical support, Microsoft Office, ServiceNow",3.8,Support Engineer
Stokhos Research Capital LLP,Senior Technical Support Specialist,Noida,5.1,"Software troubleshooting, Windows, Technical support, Firewall, IT support",0.0,Support Engineer
Placement Local Services,Desktop Support Engineer,India,2.4,"Desktop support, Operating systems, Microsoft Outlook, Software troubleshooting, Windows",0.0,Support Engineer
BD Software Distribution,Technical Support,Mahape,4.0,Technical support,2.0,Support Engineer
Andrew's Group,Technical Support,Hyderābād,3.5,"Google Suite, Software troubleshooting, Windows, Technical support, ITIL",0.0,Support Engineer
Digital Rath,Technical Support Engineer,Mumbai,39.6,"Technical support, Microsoft Office, ServiceNow",4.0,Support Engineer
NCR,IT Engineer - Customer Support Services,Mumbai,4.533333333333333,"Desktop support, Operating systems, Software troubleshooting, English, Windows",3.4,Support Engineer
Coates Group,Technical Support Engineer L2,Remote,13.571428571428571,"Microsoft Powerpoint, Microsoft Excel, Software troubleshooting, Technical support, PHP",4.2,Support Engineer
Etech Global Services,Technical Support Analyst,Gāndhīnagar,42.0,"CSS, XML, Salesforce, English, Technical support",3.7,Support Engineer
Lakshmi Computer Services,IT Administrator / System Support / Desktop Support Engineer,India,1.08,"AutoCAD, Desktop support, Microsoft Outlook, CCTV, Windows",0.0,Support Engineer
CIPL,Desktop Support Engineer,Panvel,2.82,Software troubleshooting,0.0,Support Engineer
Coempt Eduteck Private Limited,Technical Support Executive,Nashik,2.1,"English, Technical support, Microsoft Office, ServiceNow, Computer skills",0.0,Support Engineer
NCR JOB CONSULTANT,IT Support Engineer,Gurgaon,1.98,"English, Technical support, IT support, Accounting, Computer skills",0.0,Support Engineer
ManageEngine,Technical Support Engineers,Chennai,5.0,Technical support,3.4,Support Engineer
TVS ELECTRONICS LIMITED,Resident Engineer - ( Desktop Support Engineer ),Chennai,2.1,"English, Computer hardware, Communication skills",0.0,Support Engineer
Dixit Infotech Services Pvt. Ltd,Desktop Support Engineer,Bharūch,42.0,Microsoft Outlook,4.0,Support Engineer
Elinkins Technologies,Technical Support Executive ( School ERP),Delhi,12.0,"Microsoft Excel, English, Technical support, Microsoft Office, ServiceNow",0.0,Support Engineer
LetMeDoit Technologies,Technical Support Executive,Kerala,18.577777777777776,"Customer service, English, Technical support, Database management, Quality assurance",5.0,Support Engineer
