company_name,job_role,job_location,salary_lpa,skills,company_rating,standardized_job_role
Edunext Technologies Pvt. Ltd.,Technical Support Executive,India,2.0,"Microsoft Word, Microsoft Excel, English, Technical support, Microsoft Office",0.0,Support Engineer
Sabre,Technical Product Support Analyst III-VIP,Bengaluru,6.0,Time management,3.8,Support Engineer
Rotork,Support Analyst - Infrastructure,Chennai,5.5,"Microsoft Windows Server, Azure, Software troubleshooting, Windows, Computer networking",3.6,Support Engineer
Employ Inc.,"Manager, Technical Support",Bengaluru,6.0,"Knowledge management, Technical support, Microsoft Office, APIs, SaaS",2.3,Support Engineer
Fastcollab,Technical Support Engineer-Java,Hyderābād,3.5,"Technical support, Java, SQL, Continuous improvement, Spring",0.0,Support Engineer
Altera Digital Health India,"Technical Support Consultant(support, SQL) - 1871",Pune,7.0,"Computer science, Azure, Software troubleshooting, Relational databases, Technical support",3.5,Support Engineer
Pelican Services,​Pelican Services Technical Support,Hyderābād,42.0,Technical support,4.1,Support Engineer
ADCI - Karnataka,"Network Development Engineer, Operations, IT, & Support Engineering",Bengaluru,18.0,"Information security, Perl, Routing protocols, Scripting, Network support",3.6,Support Engineer
Movate,Technical Support Engineer,Chennai,36.0,"English, Technical support, Communication skills",3.6,Support Engineer
BlueBox Infosoft pvt. Ltd.,Sr. IT Support Engineer: 3 To 5 Years,India,18.865714285714287,"Microsoft Windows Server, TCP, Software troubleshooting, IIS, Customer service",3.7,Support Engineer
Team One Tech Solutions LLP,Desktop Support Engineer,Thāne,2.5,"Desktop support, Microsoft Office, Computer networking, ServiceNow",0.0,Support Engineer
CloudFoundation,Technical Support Engineer,Hyderābād,5.5,"Microsoft Windows Server, Live chat, Windows, Technical support, Computer networking",5.0,Support Engineer
Genie Infotech Private Limited (GITPL),Desktop Support Engineer,Pune,5.0,"Desktop support, Software troubleshooting, Windows, Computer networking, MacOS",3.6,Support Engineer
pulton automation,Desktop Support Engineer L1,India,2.4,"Microsoft Office, ServiceNow, Communication skills",0.0,Support Engineer
Sitaram Bhartia Institute of Science Researc,Desktop Support Engineer - Information Technology.,Delhi,13.571428571428571,"Software troubleshooting, System design, Computer networking",4.2,Support Engineer
Mind map IT Solutions,IT Customer Support Specialist,Mohali,4.073035714285714,"Microsoft Office, ServiceNow, Customer support, Communication skills",0.0,Support Engineer
Zebra Technologies,"Technical Customer Support, Senior",Pune,48.0,"Microsoft Word, Microsoft Excel, Microsoft Outlook, Customer service, Communication skills",3.9,Support Engineer
Diya Systems,Technical Support Voice,Mangalore,5.0,"Software troubleshooting, Customer service, Call center, English, Technical support",3.6,Support Engineer
Vindhya e-Infomedia,L1 Desktop Support Engineer - Bengaluru,Bengaluru,4.073035714285714,"Desktop support, TCP, Software troubleshooting, Windows, Microsoft Office",0.0,Support Engineer
ZaranTech,Technical Support Executive,Bengaluru,4.5,"English, Technical support, Communication skills",4.1,Support Engineer
CHIPTRONICS SOLUTIONS,Technical Support Executive,India,2.22,"Customer service, English, Windows, Technical support",0.0,Support Engineer
Equus,Desktop Support Engineer,Karīmnagar,2.1,Desktop support,3.0,Support Engineer
Primeindus Fintech Solutions||Indusspay,Java Technical Support Specialist,India,12.0,"English, Technical support, Java, SharePoint, Hindi",0.0,Support Engineer
Bottomline,Technical Support Consultant,Bengaluru,5.0,"FTP, SFTP, TCP, Operating systems, Oracle",3.4,Support Engineer
Quantum IT Solutions,Technical Support Engineer,India,15.544571428571428,"Microsoft Windows Server, Azure, Microsoft Outlook, LAN, English",4.6,Support Engineer
Matrix Business Machines Pvt Ltd,Desktop Support Engineer,India,38.16,"Software troubleshooting, Windows, Microsoft Office, Firewall, Network security",4.1,Support Engineer
Mars Infocare Solutions Pvt. Ltd,Desktop/Customer Support Engineer (Field IT) (Delhi/Noida Only),India,18.0,"Microsoft Outlook, Software troubleshooting, LAN, Windows, Microsoft Office",5.0,Support Engineer
WalkMe,Technical Support Engineer,Bengaluru,6.0,"CSS, Enterprise Software, SAP, Technical support, Application support",4.2,Support Engineer
SS Technologies,Desktop Support Engineer,Bengaluru,4.073035714285714,"Desktop support, iOS, English, Microsoft Office, Hindi",0.0,Support Engineer
Solenis,"Team Lead, Technical Customer Support",Bengaluru,4.5,,3.7,Support Engineer
"RAMAN IT PVT LTD.,",Technical Support Engineer,India,3.5,"Operating systems, Software troubleshooting, Customer service, Windows, Technical support",0.0,Support Engineer
swaliya softech,Technical Support Representative,Pune,5.5,Technical support,3.7,Support Engineer
Optum,Senior Tech Support Analyst Application Support,Gurgaon,30.0,"Oracle, Incident management, IT service management, Microsoft SQL Server, Technical support",3.5,Support Engineer
iLogic Network Solution Pvt Ltd,IT Support Engineer,Noida,2.7,"Azure, Remedy, Research",0.0,Support Engineer
NEO GUIDE,Technical Support (Bangalore),Cochin,2.16,"English, Technical support, Microsoft Office",0.0,Support Engineer
crutz leela,AL ML Support Engineer,Remote,7.0,"Go, English, C++, C, Natural language processing",0.0,Support Engineer
Datastraw,Customer Support Associate - Female,Remote,2.28,"CRM software, Google Docs, Customer service, English, Organizational skills",0.0,Support Engineer
Finastra USA Corporation,Support Engineer,Bengaluru,6.0,"JBoss, Azure, Oracle, Ansible, WebSphere",4.1,Support Engineer
Zeller,Application Support Engineer (AWS) (4-7 Years),Remote,20.791818181818183,"Change management, SQL, AWS, Analysis skills, Communication skills",3.8,Support Engineer
cyber hospitality private limited,Network Support Engineer,Vadodara,4.073035714285714,"Desktop support, TCP, Software troubleshooting, Load balancing, LAN",0.0,Support Engineer
Smile Security and Surveillance Pvt. Ltd.,Network Support Engineer,Delhi,3.24,"Customer service, Firewall, DHCP, Computer networking, DNS",0.0,Support Engineer
Altius Customer Services Pvt Ltd,International Process - Network Support Engineer - Vashi,Navi Mumbai,36.0,"English, Microsoft Office, Computer networking, ServiceNow, Communication skills",3.8,Support Engineer
impact pvt,VIP Support Engineer,Hyderābād,2.5,"Software troubleshooting, English, Windows, Microsoft Office",0.0,Support Engineer
Orange Hr,Sr Network Support Engineer,India,6.5,"TCP, Customer service, LAN, English, DHCP",0.0,Support Engineer
RGF HR Agent India (リクルートグループインド法人),Network Support Engineer,Chennai,3.5,"Node.js, Vendor management, CCTV, English, Network infrastructure",0.0,Support Engineer
JENX Digitech Pvt Ltd,Network Support Engineer,Hālol,2.52,"Network installation, TCP, Network protocols, Computer networking, Network support",3.0,Support Engineer
Accenture,Network Infrastructures-Application Support Engineer,Bengaluru,20.791818181818183,Network security,3.8,Support Engineer
Avils Infra Pvt Ltd,AV Support Engineer,India,4.2,Communication skills,0.0,Support Engineer
Indus Systems & Services Pvt. Ltd,L1 Support Engineer,India,3.5,"Jira, Remedy, Windows, Firewall, ITIL",0.0,Support Engineer
Shanvi Infotec,Network Support Engineer,Udaipur,3.78,"Microsoft Access, Microsoft Office, Firewall, ITIL, Network protocols",0.0,Support Engineer
STREAMLINE SOLUTIONS,Desktop & Network Support Engineer,India,6.0,"Software troubleshooting, Firewall, Network management, Remote access software, IT support",0.0,Support Engineer
Sureworks Infotech Pvt Ltd,Server Support Engineer,Hyderābād,39.6,,3.6,Support Engineer
Nexapp Technologies,"Sr.Network Engineer-NOC, L2 Customer Support",Pune,30.0,"TCP, Customer service, OSPF, Firewall, DHCP",4.1,Support Engineer
Transaction Network Services,NOC Support Engineer,India,4.533333333333333,"Microsoft Powerpoint, Microsoft Word, Microsoft Excel, Software troubleshooting, PCI",3.4,Support Engineer
S&P Global,Network Support Engineer,Gurgaon,6.5,"Kubernetes, Ansible, Load balancing, Configuration management, Git",4.1,Support Engineer
BhaiFi Networks Pvt. Limited,Network Support Engineer,Gurgaon,41.76,"Network installation, TCP, Software deployment, LAN, English",4.5,Support Engineer
Michelin,Support Engineer,Pune,9.5,"Microsoft Windows Server, TCP, Software troubleshooting, Ansible, Windows",4.0,Support Engineer
Schneider Electric,Remote Support Engineer,Bengaluru,13.571428571428571,"Microsoft Windows Server, Operating systems, Technical support, SQL, Electrical experience",4.2,Support Engineer
HSBC,Java Support Engineer/Software Engineer,Pune,9.5,"JBoss, TCP, Oracle, Node.js, Software troubleshooting",3.9,Support Engineer
ADCI HYD 13 SEZ - H84,Support Engineer,Hyderābād,13.993444444444446,"Operating systems, Software troubleshooting, Technical support, Scripting, Software development",3.6,Support Engineer
Technowand,M365 Support Engineer- Level 1,Cochin,5.0,"System administration, Azure, Microsoft Exchange, Microsoft Office, IT support",2.9,Support Engineer
Sureworks Infotech Pvt Ltd,Enterprise Support Engineer,Jaipur,39.6,Computer networking,3.6,Support Engineer
Acute Informatics Pvt. Ltd,Desktop Support Engineer L1,Calcutta,2.22,"Software troubleshooting, Microsoft Office",3.3,Support Engineer
Microsoft,Technical Support Engineering,Hyderābād,5.0,"FTP, Fiddler, TCP, System administration, Azure",4.2,Support Engineer
UNIMAPLE MODUTECH PRIVATE LIMITED,Hardware & Network Support Engineer,India,3.0,"TCP, Operating systems, LAN, Encryption, Windows",0.0,Support Engineer
Skan Netcommunications Technoloy Pvt Ltd,Computer & Network support Engineer,India,1.62,"English, Microsoft Office, Computer hardware, ServiceNow",0.0,Support Engineer
Integgral Corporate Service,Network Support Engineer,India,2.1,"English, Technical support, Microsoft Office, ServiceNow",0.0,Support Engineer
ITMantra,Customer Support Engineer,Aurangābād,4.5,"Software troubleshooting, LAN, VoIP, WAN, DNS",2.9,Support Engineer
Intellioz,Support Engineer,Noida,6.0,"Jira, System administration, SQL, ServiceNow, Linux",0.0,Support Engineer
NOKIA,Operations Support Engineer,India,23.336363636363636,"Bloomberg, Analysis skills",4.0,Support Engineer
Vitrag Enterprise Llp,Computer Desktop and Network Support Engineer ( Only Male Candidate),Gāndhīnagar,2.4,"Network installation, Operating systems, Software troubleshooting, LAN, Computer hardware",0.0,Support Engineer
PTS Systems & Solutions Pvt Ltd,Network & Desktop Support Engineer,India,25.2,"Network administration, Desktop support, Operating systems, LAN, Windows",3.9,Support Engineer
Ericsson,Support Engineer,Chennai,5.5,"Software deployment, Machine learning, Problem management, Python",4.0,Support Engineer
Kalyan Jewellers,Hardware and Network Support Engineer,Thrissur,36.0,"Network installation, CCTV, .NET, Network support",4.2,Support Engineer
Jampot Technologies,Technical Support Engineer (Fresher),Mumbai,4.5,"TCP, Technical support, Network infrastructure, VoIP, Presentation skills",3.4,Support Engineer
"Alteryx, Inc.",Customer Support Engineer,Bengaluru,7.0,"Alteryx, Windows, Communication skills",3.2,Support Engineer
Accenture,Application Support Engineer,Nāgpur,20.791818181818183,"SSL, Scripting, Network support, Communication skills, Juniper",3.8,Support Engineer
Turing.com,Desktop & Network Support Engineers,India,12.0,"Desktop support, Software troubleshooting, Network management, IT support, Network support",0.0,Support Engineer
Recruise,1700_Labs Solution Delivery and Support Engineer,Bengaluru,8.5,"Computer science, HP ALM, Oracle, Node.js, Laboratory experience",4.7,Support Engineer
MyAdvice,Website Support Engineer,Remote,13.5,"Drupal, Web analytics, CSS, WordPress, Content management systems",4.1,Support Engineer
Aarav Software Services Pvt Ltd,Application Support Engineer,Bengaluru,6.5,"Oracle, Weblogic, Continuous improvement, Linux, Apache",0.0,Support Engineer
Zenwear Technologies,Application Support Engineer,India,18.577777777777776,"Oracle, Microsoft SQL Server, Technical support, Performance management, Java",5.0,Support Engineer
Juniper Networks,L1 Technical Support Engineer – Security,Bengaluru,12.0,"FTP, NIS, TCP, Software troubleshooting, NFS",4.1,Support Engineer
SISL Infotech,Information Security Support Engineer(0 to less than 2 years relevant experience),India,19.774,Information security,4.1,Support Engineer
Bhuvi IT Solutions,System Support Engineer,Remote,13.571428571428571,"Jira, Software troubleshooting, Microsoft SQL Server, MongoDB, Technical support",4.2,Support Engineer
MicroWorld Software Services Pvt. Ltd,Security Technical Support Engineer,India,3.0,"TCP, Operating systems, Windows, Technical support, Analysis skills",2.9,Support Engineer
Ventura Securities,Application Support Engineer,India,20.791818181818183,,3.8,Support Engineer
Network Techlab (India) Pvt. Ltd,Hiring for Engineer Technical Support L1,Mumbai,36.0,"OSPF, English, Technical support, Firewall, BGP",3.8,Support Engineer
Orbit & Skyline,Information Security Support Engineer,Mohali,48.0,"Information security, SharePoint",4.0,Support Engineer
Invendis Technologies,Application support engineer​,India,18.865714285714287,"Software troubleshooting, Data analysis skills, English, Electrical experience, Telecommunication",3.7,Support Engineer
Accenture,Technology Support Engineer,Mumbai,20.791818181818183,"System administration, Network protocols, Scripting, Linux, Shell Scripting",3.8,Support Engineer
Accenture,Application Support Engineer,Pune,20.791818181818183,,3.8,Support Engineer
systems plus,Excel/VBA Support Engineer,Pune,5.5,"Microsoft Excel, Microsoft Access, Merchandising",2.9,Support Engineer
Yubi,L1 Support Engineer,Chennai,6.0,"Desktop support, Operating systems, Software troubleshooting, Customer service, Encryption",3.9,Support Engineer
Scrumconnect Consultancy,Application Support Engineer,Bengaluru,8.0,"Azure, DevOps, AWS, Analysis skills, ITIL",4.8,Support Engineer
Dixit Infotech,Remote Support Engineer,India,23.336363636363636,Communication skills,4.0,Support Engineer
Dixit Infotech Services Pvt. Ltd,Desktop Support Engineer L2,Hosūr,6.0,"Desktop support, Software troubleshooting, Windows, Microsoft Office, DHCP",4.0,Support Engineer
Oracle,Principal Support Engineer - Infra & Testing (SWIFT),India,20.791818181818183,"Oracle, Software deployment, Change management, ServiceNow, SDLC",3.8,Support Engineer
Dixit Infotech,Customer Support Engineer,Nashik,48.0,"Desktop support, IT support",4.0,Support Engineer
SISL Infotech,Information Security Support Engineer(6 Years and Above relevant experience),India,19.774,Information security,4.1,Support Engineer
ALSTOM,Fleet Support Engineer,Indore,8.5,"Automotive repair, Maximo, SAP, English, Administrative experience",3.8,Support Engineer
Atlassian,"Senior Site Reliability Engineer, Customer Support Technology",Bengaluru,6.5,"Cloud infrastructure, Azure, PaaS, Java, Microservices",3.7,Support Engineer
jaggi brothers,Desktop Support Engineer,Gurgaon,2.4,"Software troubleshooting, Ophthalmology, Microsoft Office, Computer hardware, Communication skills",0.0,Support Engineer
Accenture,Application Support Engineer,Coimbatore,20.791818181818183,"Azure, Incident management, Software troubleshooting, Kubernetes, DevOps",3.8,Support Engineer
ADCI - Karnataka,"Support Engineer, Amazon Payment Products",Bengaluru,7.0,"AWS, Project management, Distributed systems, Scripting, Software development",3.6,Support Engineer
Aspen Technology,Field Support Engineer I,Bengaluru,8.5,"Oracle, Microsoft SQL Server, Windows, Databases, SQL",3.2,Support Engineer
Accenture,Technology Support Engineer,Coimbatore,20.791818181818183,"Microsoft Powerpoint, CI/CD, System administration, Azure, Gradle",3.8,Support Engineer
Vivid Led System,Field Support Engineer,India,1.8,"Software troubleshooting, ServiceNow, Communication skills",0.0,Support Engineer
Sunware Technologies Private Limited,Dot Net Support Engineer,Pune,11.5,"ASP.NET, MVC, Visual Basic, .NET Core, C#",0.0,Support Engineer
BISINTECH IT SOLUTIONS PVT LTD,Network Support Engineer,India,1.8,"TCP, Software troubleshooting, Network infrastructure, DHCP, Analysis skills",0.0,Support Engineer
Orbit & Skyline,Senior Product Support Engineer,Mohali,23.336363636363636,"Image processing, Software troubleshooting, Computer vision, Laboratory experience, Analysis skills",4.0,Support Engineer
NielsenIQ,Senior Support engineer,Pune,8.0,"Power BI, Azure, Software troubleshooting, Software deployment, Enterprise Software",3.8,Support Engineer
HealthEdge,Senior Application Support Engineer,Pune,5.0,"CI/CD, Performance tuning, System administration, Azure, Oracle",3.5,Support Engineer
Airlinq,Sr. Technical Engineer (L2 Support Engineer),Bengaluru,3.0,"Internet of things, Solaris, SQL, VoIP, Perl",3.2,Support Engineer
CARE INFOTECH,Software Support Engineer,Hyderābād,1.8,"Software troubleshooting, Windows, .NET, Java, Analysis skills",0.0,Support Engineer
Reliable Software Systems Pvt Ltd,Software Support Engineer,Mumbai,48.0,Communication skills,3.8,Support Engineer
Esko,Software Support Engineer - Solutions Support,Bengaluru,6.5,"English, IT support",3.3,Support Engineer
Growen,JUNIOR SOFTWARE SUPPORT ENGINEER,Calicut,4.073035714285714,"Microsoft SQL Server, SQL, Communication skills",0.0,Support Engineer
Ezulix Software,Technical Support Executive/Voice Process,Jaipur,16.60909090909091,"Operating systems, Technical support, Computer networking, Communication skills",4.3,Support Engineer
