company_name,job_role,job_location,salary_pa,skills,company_rating,standardized_job_role
Crypto Mize,Marathi Writer,Delhi,0.0,"Marathi, English, Information security, Chef",4.8,Content Writer
Exela Technologies,Content Writer,Pune,3000000.0,"Research, Communication skills, Marketing",3.6,Content Writer
Acquaint Softtech,Technical Content Writer,Ahmedabad,150000.0,"Search engines, English, Research, Application development, Proofreading",3.2,Content Writer
Emson Industries,Content Writer,India,270000.0,"Writing skills, English, Research, Proofreading, Hindi",,Content Writer
Solutions 1313,Content Writer,Mohali,360000.0,"Keyword research, Writing skills, English, Linkbuilding, SEO",,Content Writer
Rubrik Job Board,Technical Publications Editor,Bengaluru,550000.0,"XML, Git, English, Machine learning, Technical writing",3.7,Content Writer
Crypto Mize,French Writer,Delhi,0.0,"French, Creative writing, English, Research, Information security",4.8,Content Writer
Agilent Technologies Inc.,Senior Science Writer/Editor,Karnataka,0.0,"English, Communication skills",4.0,Content Writer
Geek Shastra Technology,Technical Content Writer,Jaipur,252000.0,"English, Technical writing, Proofreading",,Content Writer
Vertiv,"Junior Writer, Portfolio Content Creation",India,0.0,"Content management systems, English, Microsoft Office, Project management, Smartsheet",3.6,Content Writer
Enzigma Software,Technical Content Writer,Pune,500000.0,"Node.js, React, English, Analysis skills, REST",4.0,Content Writer
Sygul,Content Writer,Cochin,500000.0,"Keyword research, English, SEO, Technical writing",4.8,Content Writer
Crypto Mize,News Writer,Delhi,0.0,"Journalism, English, Information security, SEO, Computer skills",4.8,Content Writer
Zennode Technologies,Technical Content Writer ( 1 year Exp. ),Calicut,4800000.0,"UI, Communication skills",4.8,Content Writer
Geek Web Solution,Technical Content Writer,Surat,2088000.0,"Email marketing, Web analytics, WordPress, Writing skills, English",5.0,Content Writer
Webential Technologies,Content Writer,Ahmedabad,450000.0,"Search engines, Keyword research, Writing skills, Research, SEO",3.0,Content Writer
Wiplon,Content Writer,Jaipur,350000.0,"Keyword research, English, Communication skills, Time management",,Content Writer
CrelioHealth,Content Writer,Pune,500000.0,"Social media management, English, Research, Graphic design, Technical writing",4.1,Content Writer
Crypto Mize,Bengali Writer,Delhi,0.0,"Writing skills, Bengali, English, Microsoft Office, Information security",4.8,Content Writer
OCULUSIT,Content Writer,Gurgaon,4200000.0,"Microsoft Powerpoint, Microsoft Word, Microsoft Office, Market research, Communication skills",3.9,Content Writer
Mansukh,Content Writer,Delhi,0.0,"Microsoft Word, Google Docs, Microsoft Excel, WordPress, Writing skills",3.4,Content Writer
AlmaMate Info Tech,Content Writer,Gurgaon,900000.0,"Keyword research, Writing skills, English, SEO, B2B Marketing",,Content Writer
Kody Technolab,Technical Content Writer,Ahmedabad,450000.0,"Keyword research, Writing skills, Research, Content creation, SEO",4.5,Content Writer
Client of SolutionBox,Technical Content Writer(Solar Industry),India,312000.0,"Keyword research, Writing skills, English, SEO, Technical writing",3.0,Content Writer
Mindkosh Technologies,Technical Content Writer,Delhi,0.0,,,Content Writer
Sunstone Education Technology,Content Writer,Gurgaon,550000.0,"Analysis skills, Communication skills",4.1,Content Writer
ACG Worldwide,Engineer/Writer,Shirwal,550000.0,,3.8,Content Writer
SSPL,Technical Software Content Writer,Delhi,0.0,"Microsoft Powerpoint, Microsoft Word, Microsoft Excel, Visio, Microsoft Office",4.0,Content Writer
Phygital Insights,Technical Writer,Mumbai,0.0,"Technical writing, APIs, Communication skills",4.9,Content Writer
Hisab,Content writer,Surat,500000.0,"Blogging, Writing skills, English, Communication skills",,Content Writer
Allerin,Content Writer,Navi Mumbai,4200000.0,"English, Research, Application development, Presentation skills, SEO",4.4,Content Writer
Zuan Education,Content Writer,Chennai,3600000.0,"Research, Technical writing, Content management, Proofreading, Copywriting",5.0,Content Writer
ATS Corporation,Content Writer Intern,Bengaluru,0.0,"Microsoft Publisher, UX, SharePoint, Technical writing, UI",2.9,Content Writer
Cibirix,Content Writer,Indore,3600000.0,"Social media management, English, Communication skills",4.2,Content Writer
Webcap Technology,Content Writer,India,0.0,"Proofreading, Communication skills",5.0,Content Writer
SysInfo Tools Software,Technical Content Writer,Noida,0.0,,,Content Writer
Codemech Solutions,Content Writer,Ahmedabad,450000.0,"Writing skills, English, Research, Proofreading, Communication skills",4.5,Content Writer
Vivanta Technologies,Content Writer,Bengaluru,0.0,"Keyword research, English, SEO",1.9,Content Writer
Gartner,Writer,Gurgaon,450000.0,"Microsoft Powerpoint, Microsoft Word, Google Suite, Microsoft Excel, Microsoft Outlook",4.0,Content Writer
Council for Robotics & Automation (AICRA),PR Trainee / Content Writer,Delhi,2520000.0,English,3.9,Content Writer
IM Solutions,Content Writer,Bengaluru,550000.0,"English, Research, Proofreading, Communication skills",4.4,Content Writer
CMARIX TechnoLabs,Technical Content Writer,India,0.0,"English, Research, SEO",4.1,Content Writer
Cleartax,Content Writer - Mutual Funds,Bengaluru,2400000.0,"AI, Communication skills",3.6,Content Writer
Brand Hype,Content Writer,Gurgaon,4800000.0,"WordPress, Public relations, Google Analytics",3.9,Content Writer
Primafelicitas,Technical Content Writer,Noida,4200000.0,"English, Microsoft Office, IT, HTML",4.0,Content Writer
Cognitech Web Solutions,Technical Content Writer,Calcutta,0.0,"Digital marketing, SEO, Technical writing",,Content Writer
StrikeTru,Digital Marketing Content Writer,Hyderābād,450000.0,"Microsoft Powerpoint, Microsoft Office, E-Commerce, Digital marketing, Data management",4.2,Content Writer
Optim Hire INC,Sr. Technical writer – IC role,Gurgaon,0.0,"English, Quality assurance, Electrical experience, Technical writing, Agile",3.6,Content Writer
Duplex Technologies,content writer,Lucknow,180000.0,"Google Docs, Writing skills, English, Research, Microsoft Office",,Content Writer
Info Stans Pvt. Ltd.,Technical Content Writer,Ahmedabad,300000.0,"WordPress, Writing skills, Content management systems, English, Research",,Content Writer
AcmaSoft Web Solutions,Technical Content Writer,India,0.0,"WordPress, Writing skills, English, Research, Graphic design",,Content Writer
requinsolutions private limited,Technical Content Writer,Jaipur,150000.0,"Word processing, Visio, English, Research, Technical writing",,Content Writer
Netgains,Technical Content Writer,Mohali,360000.0,"Writing skills, English, Technical writing, APIs, Proofreading",1.9,Content Writer
Headhunterz,Content Writer/Copy Writer Noida,India,0.0,"Journalism, English, SEO, Technical writing",,Content Writer
Globosoft Solutions,Content Writer,Cochin,400000.0,"Multilingual, Writing skills, Malayalam, English, B2B",,Content Writer
Fluid.Live Solutions Pvt Ltd,Content Writer,Pune,4800000.0,"Microsoft Word, Microsoft Outlook, English, Microsoft Office, Risk analysis",4.4,Content Writer
Ipat Techsolution,Content Writer,India,0.0,"Technical writing, Communication skills",5.0,Content Writer
Esearch logix technologies pvt.ltd.,Senior Content Writer,India,300000.0,"Search engines, Computer science, English, Research, SEO",,Content Writer
Insight Print Communications Pvt. Ltd.,Content Writer,India,294000.0,"Creative writing, Writing skills, Research, Content creation, Product demos",3.3,Content Writer
Parexel,Senior Medical Writer,Remote,0.0,"Analysis skills, Communication skills",4.0,Content Writer
ITSILVER Innovation & Infotainment,Content Writer,Mumbai,108000.0,"English, ISO 9001, Technical writing",,Content Writer
Befisc Pvt Ltd,Senior Content Writer,Noida,780000.0,"PCI, Creative writing, English, Research, Quality assurance",,Content Writer
Crypto Mize,Portuguese Writer,Delhi,0.0,"Writing skills, English, Information security, Portuguese, Chef",4.8,Content Writer
Appvin Technologies,Technical Content Writer,Noida,270000.0,"Creative writing, Writing skills, English, Human resources, Technical writing",,Content Writer
Crypto Mize,Spanish Writer,Delhi,0.0,"Blogging, Spanish, Multilingual, English, Information security",4.8,Content Writer
DataCouch,Sr Technical Content Writer,Mohali,450000.0,"Microsoft Word, Google Docs, WordPress, Writing skills, English",4.9,Content Writer
NIKOL AUTOMOTIVE PVT LTD,Content Writer Intern,Pune,48000.0,"Microsoft Word, English, Research, Proofreading, Hindi",,Content Writer
suntec india,Content Writer,Pitampura,360000.0,"Web accessibility, Writing skills, English, Content development, Usability",,Content Writer
Sri Gajanan E-Slates Private Limited,C++ Technical Content Writer / Subject Matter Expert,India,0.0,"Telugu, Writing skills, English, C++, C",,Content Writer
MrMed,Medical Content Writer,India,0.0,"Writing skills, English, Medical terminology, Communication skills, Marketing",,Content Writer
VISTA InfoSec,Junior Content Writer,Mumbai,0.0,"Marathi, English, Technical writing, Hindi",3.9,Content Writer
Crypto Mize,Deutch Writer,Delhi,0.0,"English, Information security, Records management, Chef, Communication skills",4.8,Content Writer
Logilite Technologies,Technical Content Writer,Ahmedabad,450000.0,"Software deployment, English, Communication skills",3.9,Content Writer
Netens Technologies,Content Writer,Delhi,0.0,"Technical writing, Communication skills",,Content Writer
Outshine Solutions,Technical Content writer,Noida,450000.0,"Presentation skills, Communication skills",2.5,Content Writer
Webindia Master,English Content Writer,Ghaziabad,240000.0,"Keyword research, Writing skills, English, Research, Proofreading",,Content Writer
Mozilor,Lead Technical Writer,Calicut,2400000.0,"CSS, Content management systems, SEO, B2B, Agile",4.8,Content Writer
Inogic,Technical Content Writer,Navi Mumbai,450000.0,"Power BI, Azure, Press releases, SDKs, SEO",3.7,Content Writer
Developer's Adda,Technical Content Writer,Noida,120000.0,"Computer science, Google Docs, WordPress, Keyword research, Writing skills",,Content Writer
Voso Store,Content Writer,Indore,0.0,"English, Communication skills",4.0,Content Writer
ProRelix Research,Medical Writer - II,Pune,0.0,"Clinical research, Microsoft Office, Clinical trials, Document management systems, Medical terminology",,Content Writer
Jploft Solutions Pvt.Ltd.,Technical Content Writer,Jaipur,2400000.0,"Writing skills, Mobile applications, English, Content marketing, Technical writing",4.5,Content Writer
Woodpecker Technologies,Content Writers - Technical,Delhi,0.0,,,Content Writer
Orion Infosolutions,Content Writer,Jaipur,174000.0,"Keyword research, Creative writing, Writing skills, English, Research",,Content Writer
Saletify Marketing,Content Writer,Pune,4800000.0,"English, Organizational skills, Proofreading, Time management, Copywriting",4.0,Content Writer
ResearchBrains 99407-74051,Technical Content Writer,India,162000.0,"English, Technical writing, Computer skills, Proofreading",,Content Writer
Sanofi,Expert Scientific Writer - Omnichannel,Hyderābād,700000.0,"English, Research, Project management, Content creation, Agile",4.0,Content Writer
eTest Automations,Content Writer,Bengaluru,500000.0,"Adobe Photoshop, Technical writing, CorelDraw, Marketing",,Content Writer
Easyrewardz Software Services Private Limited,B2C Content Writer,Gurgaon,300000.0,,3.4,Content Writer
Global Education,Content Writer,Nāgpur,0.0,"English, .NET, Communication skills, HTML",3.8,Content Writer
Best Bus,Content Writer cum SEO Analyst,Hyderābād,4800000.0,"SEO, Communication skills",4.5,Content Writer
Crypto Mize,Tamil Writer,Delhi,0.0,"Keyword research, Writing skills, Content management systems, English, Microsoft Office",4.8,Content Writer
Crypto Mize,Copywriter,Delhi,0.0,"Research, Information security, SEO, Organizational skills, Typing",4.8,Content Writer
Highxbrand India Pvt Ltd,Technical Content Writer,Delhi,282000.0,"WordPress, Keyword research, Writing skills, Content management systems, English",,Content Writer
Coleda B2B,Content Writer,Pune,450000.0,"English, Microsoft Office, SEO, Content marketing, B2B",4.1,Content Writer
Digital Samrat,Content Writer,India,0.0,English,,Content Writer
Gove Enterprises,Content Writer,Tirunelveli,0.0,"English, Content development, Content marketing, Scrum, Agile",2.3,Content Writer
Sanofi,Associate Scientific Writer - Omnichannel,Hyderābād,700000.0,"Microsoft Powerpoint, Microsoft Word, English, Research, Project management",4.0,Content Writer
Terafac Technologies Pvt. Ltd.,Technical Content Writer,Chandigarh,198000.0,"Internet of things, Writing skills, English, Technical writing, Manufacturing",,Content Writer
GajShield Infotech (I) Pvt. Ltd.,Technical Content Writer,Ahmedabad,4200000.0,"Search engines, Writing skills, Research, SEO, Organizational skills",3.9,Content Writer
Aon Corporation,Associate Consultant - Content Writer,Mumbai,0.0,"Microsoft Word, Google Docs, Microsoft Excel, Organization design, Research",3.8,Content Writer
ILLUMINZ,Content Writer,Mohali,350000.0,"Go, Research, SEO",2.8,Content Writer
SNACHOO PORTAL,Content Writer,Cochin,0.0,"Writing skills, ERP systems, English, Research, Analysis skills",,Content Writer
webreinvent,Technical Content Writer,Delhi,0.0,"Google Docs, English, Research, Communication skills",3.2,Content Writer
ManageEngine,Content/Technical Writers,Chennai,500000.0,,3.4,Content Writer
Codilar Technologies,Senior Content Writer,Bengaluru,4800000.0,"Research, SEO, Content marketing, Proofreading, Communication skills",3.7,Content Writer
The Aspiring CEO,Content Writer,Lucknow,150000.0,"Press releases, Lead generation, English, Research, SEO",,Content Writer
Abserve Tech,SEO/ Content Writer,India,0.0,"Keyword research, Google Search Console, SEO tools, Google Analytics",4.6,Content Writer
HCP Wellness PVT. LTD.,Skin Care Content Writer – Beauty Blog Copywriter Jobs,India,0.0,"Keyword research, English, SEO, Content marketing, Communication skills",1.0,Content Writer
HashStudioz Technologies,Content Writer,Noida,4200000.0,"Internet of things, Research, Analysis skills, SEO, Communication skills",4.0,Content Writer
Digiworld Solution,Content Writer and Editor,India,336000.0,"English, Research, SEO",,Content Writer
Media 7,Associate content writer,Pune,4800000.0,"Keyword research, English, Content creation, SEO, B2B",4.0,Content Writer
Friday Media Group,Content Writer,Bengaluru,600000.0,"Computer science, Microsoft Excel, Keyword research, Content management systems, English",4.1,Content Writer
Ignek Infotech,Content Writer,India,4320000.0,"WordPress, Keyword research, Writing skills, Research, Content creation",4.4,Content Writer
one portfolio pvt ltd,Content Writer,India,510000.0,"Email marketing, Branding, Google Docs, WordPress, Keyword research",,Content Writer
Geek Shastra Technology,Senior Academic Content Writer,India,300000.0,"Proofreading, Instructional design",,Content Writer
Acquaint softtech PVT LTD,Technical Content Writer,India,240000.0,"Search engines, English, Research, Application development, Proofreading",,Content Writer
Immortal dreamz,Content Writer,Bengaluru,0.0,"English, SEO, Proofreading, Communication skills",,Content Writer
Theory of Physics,Content Writer,Gwalior,420000.0,"Creative writing, English, Research, Technical writing, Hindi",,Content Writer
OneOnic,Blog / Content Writer,Rājkot,0.0,"WordPress, English, Research, SEO, Communication skills",,Content Writer
Fortinet,Sr Principal Technical Writer,Bengaluru,650000.0,"CSS, XML, English, Research, Analysis skills",3.8,Content Writer
Colan Infotech,Content Writer,Chennai,4800000.0,"Writing skills, SEO, Copywriting",3.7,Content Writer
Third Rock Techkno,Technical Content Writer,Ahmedabad,3000000.0,"Keyword research, Writing skills, Content management systems, English, Research",4.8,Content Writer
CMP Techsseract LLP,Technical Content Writer,Lucknow,102000.0,"Writing skills, English, Technical writing, APIs, Proofreading",,Content Writer
Nielsen,Technical Writer,Mumbai,300000.0,"Microsoft Word, CI/CD, Google Docs, WordPress, Kanban",3.3,Content Writer
J P Extrusiontech,Technical Writer & Product Marketing,Ankleshwar,450000.0,"Microsoft Powerpoint, Microsoft Word, Adobe Photoshop, Microsoft Excel, Adobe Illustrator",4.0,Content Writer
Cetark Corp,Content Writer,Mohali,270000.0,"Keyword research, Writing skills, Press releases, English, Research",,Content Writer
QuEST Global,Lead Technical writer,Bengaluru,800000.0,"Mechanical engineering, Operating systems, English, Windows, Microsoft Office",3.7,Content Writer
Nethram,Technical content writer,Kerala,0.0,"Writing skills, English, Microsoft Office, Computer skills, Proofreading",5.0,Content Writer
ibruk Consulting,Technical Writers,Mumbai,300000.0,"Microsoft Word, English, Technical writing, Communication skills",3.4,Content Writer
infledge,Content Writer,Bhopal,400000.0,"Microsoft Word, Google Docs, XML, Big data, Research",,Content Writer
Qualimatrix Technologies,Content Writer,India,150000.0,"WordPress, Creative writing, Writing skills, Content management systems, Research",,Content Writer
iDreamBiz,Content Writer,Noida,4200000.0,"Research, Content development, SEO, B2B, Communication skills",4.3,Content Writer
UniConverge Technologies Pvt. Ltd.,Technical Content Writer Intern,Noida,1224000.0,"Writing skills, Visio, English, Technical writing, Proofreading",4.3,Content Writer
Panacorp Computer Academy,Content Writer - Research Assistance,Nagercoil,222000.0,"Microsoft Word, Microsoft Excel, Writing skills, English, Research",,Content Writer
Inogic Tech India Pvt Ltd,Technical Content Writer,India,0.0,"Blogging, Writing skills, Press releases, Content creation, SEO",,Content Writer
Instance IT Solutions,Content Writer,Surat,4200000.0,,4.7,Content Writer
Talenscape Digital,Technical Content Writer,India,550000.0,"Search engines, Writing skills, Research, Analysis skills, Content creation",,Content Writer
Forcesight Online Solutions Pvt. Ltd.,Technical Document Writer (SaaS - Ecommerce Financial Analysis),Coimbatore,450000.0,"Visio, Git, E-Commerce, Confluence, Technical writing",,Content Writer
NetWorld,Technical Content Writer,India,3240000.0,"Writing skills, English, Technical writing, Agile, Proofreading",4.0,Content Writer
Yaali Bizappln Solutions,Content Writer,Chennai,4200000.0,"Keyword research, SEO, Conversion optimization, Communication skills",4.2,Content Writer
Synopsys,"Tech Writer, Senior",Bhubaneshwar,700000.0,"Microsoft Powerpoint, Writing skills, Product development, Technical writing, Communication skills",4.0,Content Writer
Mtoag,Content Writer,Jaipur,0.0,"English, Communication skills",2.9,Content Writer
Ascezen Consulting,"Technical Writers, Content Writers, and E-learning Developers",Lucknow,600000.0,English,4.0,Content Writer
Concretio Apps Pvt. Ltd.,Technical Content Writer,Jaipur,240000.0,"Keyword research, English, Research, Content creation, AI",,Content Writer
VST Mobility Solutions,Content Writer,Kerala,0.0,"Project management, Technical writing, Communication skills, Information architecture",3.5,Content Writer
Mantra Softech India Pvt Ltd,Content Writer,Ahmedabad,500000.0,"Writing skills, Journalism, English, SEO, Marketing",4.4,Content Writer
Gov2Biz,Senior Proposal Writer,Indore,1300000.0,"CRM software, Procurement, Enterprise Software, Writing skills, Microsoft Office",,Content Writer
ibruk Consulting,Trainee Technical Writers,Mumbai,300000.0,"Microsoft Word, English, Content development, Software development, Customer support",3.4,Content Writer
AppQuarterz Technologies,Technical Content Writer,Farīdābād,198000.0,"Writing skills, English, Research, Analysis skills, Proposal writing",,Content Writer
Silicon Engineering Consultants,Content Writer,Ahmedabad,0.0,"English, Human resources",2.6,Content Writer
Atkku Services,Technical Content Writer,Coimbatore,500000.0,"WordPress, Writing skills, SEO, B2B, SaaS",3.0,Content Writer
CyberNX Technologies Pvt Ltd.,Content Writer,India,2880000.0,"Blogging, Research, Content creation, SEO, B2B",3.5,Content Writer
Crypto Mize,Medical Content Writer,Delhi,0.0,"Microsoft Word, English, Information security, Chef",4.8,Content Writer
Somya Translators,Content Writer,Delhi,0.0,Content marketing,4.4,Content Writer
HIR INFOTECH,Technical Content Writer,India,0.0,"WordPress, Content management systems, Research, SEO",4.9,Content Writer
ValueHR services,Demand Generation Associate - Content Writer,India,270000.0,"Drupal, Customer service, Writing skills, English, Hindi",,Content Writer
Sanofi,Expert Medical Regulatory Writer,Hyderābād,700000.0,"Writing skills, English, Diagnostic evaluation, Project management, Agile",4.0,Content Writer
Yeasi Tech Pvt Ltd,Content Writer,West Bengal,0.0,"English, Communication skills",,Content Writer
Firstatom Technologies,Content Writer,India,0.0,"WordPress, Creative writing, Technical writing",4.0,Content Writer
Brains & Machines Innovative Solutions,Senior Technical Writer,Hyderābād,550000.0,"Microsoft Powerpoint, Wiki systems, Visio, Microsoft Office, SDKs",4.2,Content Writer
Duckman Technologies,Technical Content Writer,Mumbai,90000.0,"Writing skills, English, Content creation, Digital marketing, SEO",,Content Writer
ADEO DISTINCTIONS & DIMENSIONS PVT LTD,CONTENT WRITER,Vapi,420000.0,"Writing skills, English, Research, Microsoft Office, SEO",,Content Writer
TELUS Digital -,PRP Writer Analyst - Mumbai India,India,0.0,"Arabic, Bengali, English, Communication skills",3.6,Content Writer
Vega Moon Technologies,Content Writer Jobs | Content Writer Required,Janakpuri,2880000.0,"Web design, Keyword research, Writing skills, English, SEO",4.5,Content Writer
Mentor Thesis,Technical Content Writer,Kuzhittura,114000.0,"Microsoft Office, Technical writing, Time management",,Content Writer
Trioangle Technologies,Trainee - Digital Marketing/ Technical Content Writer,Gāndhī Nagar,600000.0,,,Content Writer
Aurassure Pvt Ltd,Content Writer,India,258000.0,"Writing skills, Content management systems, English, Research, SEO",,Content Writer
Eduaxs Solutions,Content Writer Intern,Noida,1080000.0,"Search engines, Writing skills, Proposal writing, SEO, Technical writing",5.0,Content Writer
Stock Axis,Content Writer (Stock Market Research),Mumbai,0.0,"Journalism, English, Microsoft Office, Financial analysis, Analysis skills",,Content Writer
dJAX Technologies,CONTENT WRITER,Bengaluru,500000.0,"Search engines, English",3.9,Content Writer
Werq Labs Pvt Ltd,Technical Content Writer,India,210000.0,"Microsoft Powerpoint, Microsoft Word, Email marketing, Google Docs, Microsoft Excel",,Content Writer
LRN Corporation,Technical Writer,Mumbai,4200000.0,"Software development, Agile, Communication skills",3.8,Content Writer
Crypto Mize,Assamese Writer,Delhi,0.0,"English, Information security, Assamese, Chef, Communication skills",4.8,Content Writer
Emmes Global,Senior Technical Writer,Bengaluru,600000.0,"Jira, Microsoft Word, English, Confluence, Software development",2.6,Content Writer
edge CRM,Mechanical Content Writer,Mumbai,3600000.0,"Mechanical engineering, English",4.3,Content Writer
RAHUL B GUPTA & CO.,Technical Content Writer,Chandigarh,210000.0,"WordPress, Keyword research, Writing skills, Content management systems, English",,Content Writer
eGrove Systems Pvt. Ltd,Proposal Writer,Chennai,250000.0,"English, AWS, Proposal writing, Technical writing, Communication skills",,Content Writer
Avista Web Technologies,Content Writer/ Sr. Content Writer,Vadodara,3000000.0,"Research, Content creation, SEO, Content marketing, Copywriting",4.0,Content Writer
Vertiv,Lead Writer,India,0.0,"Mechanical engineering, Content management systems, English, Microsoft Office, White papers",3.6,Content Writer
isummation technologies,Content Writer,India,0.0,"Social listening, CSS, Social media marketing, Social media management, Research",4.7,Content Writer
Cognitech Web Solutions,Web Content Writer,Calcutta,0.0,"Digital marketing, SEO, Technical writing",,Content Writer
Kaushalam,Content Writer,Ahmedabad,4200000.0,"English, Microsoft Office, Technical writing",3.7,Content Writer
Trycyfer technologies,Technical Content Writer,Mohali,270000.0,"Writing skills, English, Content creation, SEO, Proofreading",,Content Writer
loan DPR,Content Writer,Pune,294000.0,,,Content Writer
Sourcedesk Global,Technical Content Writer/ Sr. Technical Writer,Calcutta,3000000.0,"Blogging, Social media marketing, Social media management, English, Digital marketing",4.5,Content Writer
Cognus technology,Content Writer,Udaipur,210000.0,"English, Communication skills",3.0,Content Writer
AllTheResearch,Content Writer - Technology,India,0.0,"WordPress, Keyword research, Writing skills, Content management systems, English",5.0,Content Writer
Searchcom Technologies,Content Writer,Vadodara,250000.0,"English, SEO, Technical writing, Computer skills",,Content Writer
Verity Infosol,Proposal Writer /Bid Management,Hyderābād,0.0,"Microsoft Powerpoint, Microsoft Word, Web design, English, Business development",,Content Writer
Crypto Mize,Oriya Writer,Delhi,0.0,"Keyword research, Odia, English, Information security, Content creation",4.8,Content Writer
Grapes Worldwide,Content Writer (B2B),Delhi,0.0,"Writing skills, Quality assurance, Digital marketing, Content development, SEO",,Content Writer
ACSASS,Academic content writer,India,108000.0,"Writing skills, Content management systems, English, Microsoft Office, Typing",,Content Writer
Crypto Mize,Korean Writer,Delhi,0.0,"English, Information security, Korean, Translation, Chef",4.8,Content Writer
