company_name,job_role,job_location,salary_pa,skills,company_rating,standardized_job_role
Motherson,Content Writer,Gurgaon,450000.0,"English, Research, Digital marketing, Content marketing, Proofreading",3.5,Content Writer
Big Oh Notation (OPC) Pvt.Ltd.,Content Writer,Noida,4800000.0,"Creative writing, English, Microsoft Office, Technical writing",3.5,Content Writer
IndraSur Consulting Services,Resume Writer,Mohali,4800000.0,,3.5,Content Writer
IndustryARC,Content Writer,Hyderābād,250000.0,"English, Research",3.0,Content Writer
Tradeboox,Technical Writer,Delhi,0.0,"Microsoft Office, Software development, Technical writing, Communication skills",4.0,Content Writer
iMatiz Technologies,Technical Content Writer,Bengaluru,500000.0,,3.3,Content Writer
Provenir Inc.,Technical Writer,Bengaluru,600000.0,"Microsoft Powerpoint, Adobe Photoshop, CSS, Writing skills, Content management systems",3.2,Content Writer
Appventurez,Technical Content Writer,Noida,270000.0,"Microsoft Word, Drupal, Google Docs, WordPress, Keyword research",,Content Writer
Accenture,Industry X - Technical Writer - Automotive - Parts Catalogue - 10,Bengaluru,0.0,"AutoCAD, SAP, Adobe Illustrator, Analysis skills, SolidWorks",3.8,Content Writer
Capital Placement Services,"Content Writer For IT Company in Sector- 48,Gurugram",Gurgaon,400000.0,"English, Communication skills",,Content Writer
Sanofi,Scientific Writer - Omnichannel,Hyderābād,700000.0,"Microsoft Powerpoint, Microsoft Word, English, Research, Project management",4.0,Content Writer
ThoughtMate,Technical Content Writer,Ahmedabad,450000.0,Writing skills,,Content Writer
CodeClouds,Technical Content Writer,Calcutta,4200000.0,"Web development, Word processing, Writing skills, English, Communication skills",4.4,Content Writer
reccon,Technical Content Writer,Bengaluru,318000.0,"WordPress, Keyword research, Writing skills, Content management systems, English",,Content Writer
Sanofi,Medical Regulatory Writer,Hyderābād,700000.0,"Interpretation, Writing skills, English, Communication skills",4.0,Content Writer
Amfill Digital Services,Technical Writers,Delhi,0.0,"English, Typing",4.5,Content Writer
EFY Enterprises,Technology Journalist / Writer,Delhi,0.0,"Internet of things, English, Communication skills",4.0,Content Writer
Model N,Technical Documentation Writer,Hyderābād,700000.0,"Writing skills, English, Microsoft Office, Agile, Communication skills",3.7,Content Writer
Aristocrat,Technical Writer,Gurgaon,700000.0,"XML, Journalism, English, Research, Microsoft Office",3.7,Content Writer
Nxtlogic Software Solutions,PhD Research Writer (Computer Science),Chennai,450000.0,"Computer science, Research, Machine learning, Data science",5.0,Content Writer
Beckman Coulter Life Sciences,Senior Scientific Writer,Calcutta,500000.0,"English, Content creation, Communication skills",3.5,Content Writer
Jabalpurwala,Content Writer Intern,Remote,0.0,"Writing skills, Research, Content creation, Digital marketing, SEO",,Content Writer
Siemens Energy,Technical Writer,Pune,550000.0,"Adobe Photoshop, Content management systems, Adobe Creative Suite, Project management, Electrical experience",4.2,Content Writer
Qualcomm,Technical Writer,Bengaluru,4200000.0,"XML, Writing skills, Content management systems, Adobe Illustrator, Visio",3.9,Content Writer
Corent Technology,Technical Writer,Chennai,4800000.0,"APIs, Communication skills",3.7,Content Writer
Sanofi,Senior Scientific Writer,Hyderābād,700000.0,"English, Project management, Content creation, Communication skills",4.0,Content Writer
C+A Global,Technical Content Writer,Mohali,2880000.0,"Writing skills, English, Technical writing, Proofreading, Communication skills",3.8,Content Writer
Qualcomm,"Technical Writer, Staff",Bengaluru,4200000.0,"XML, Writing skills, Content management systems, Adobe Illustrator, Visio",3.9,Content Writer
MarketWick pvt ltd,Technical Content Writer,Noida,400000.0,"Microsoft Word, Drupal, Google Docs, CSS, WordPress",,Content Writer
DigiMantra Labs,Technical Content Writer,Mohali,3240000.0,"Keyword research, Writing skills, Content management systems, English, Research",4.1,Content Writer
Aloha Technology,Content Writer(Technical/Non-Technical),Pune,0.0,"WordPress, SEO, Marketing",3.5,Content Writer
Enercomp Solutions,Technical Content Writer,India,0.0,,3.0,Content Writer
Travarsa,Technical Writer Job,Pune,3600000.0,"Web design, Adobe Photoshop, Social media management, Keyword research, Adobe Illustrator",5.0,Content Writer
Appventurez Mobitech,Technical Content Writer,Noida,0.0,"Research, Technical writing, Content management, Proofreading",,Content Writer
Unified Cloud,Technical Content/Document Writer,Noida,650000.0,"Web design, English, Research, Microsoft Office, Business development",3.3,Content Writer
Recruise,1700_SR Medical Writer,Bengaluru,600000.0,"Project management, Time management",4.7,Content Writer
Perceptive,Senior Medical Writer,Hyderābād,600000.0,"Microsoft Powerpoint, Microsoft Word, Power BI, Microsoft Excel, Clinical research",2.7,Content Writer
Novelvista,Content Writer,India,0.0,"Microsoft Outlook, Sales, Social media management, Lead generation, English",3.5,Content Writer
IRIS Business Services,Technical Content Writer,India,0.0,"Jira, CSS, Software troubleshooting, Git, Application development",3.9,Content Writer
THE THIRSTY CROW MARKETING SERVICES,Senior Content Writer,Mumbai,450000.0,"Creative writing, Technical writing, Proofreading, Content strategy",,Content Writer
Mazenet solution,Technical Writer,Chennai,750000.0,"Web accessibility, Azure, Cloud architecture, Git, AWS",3.9,Content Writer
identixweb,Technical Content Writer Job in Surat,Surat,450000.0,"Keyword research, English, Technical writing",4.7,Content Writer
eSearch Logix Technologies Pvt. Ltd.,Technical Content Writer,India,390000.0,"Web accessibility, Writing skills, English, Research, Content development",1.0,Content Writer
Sitetracker,Junior Knowledge Management Lead - Tech writer,Bengaluru,600000.0,"Wiki systems, Salesforce, 5G, English, Project management lifecycle",3.8,Content Writer
FLAME University,Content Writer,Pune,3600000.0,"Keyword research, Writing skills, Content management systems, English, Research",4.3,Content Writer
Sanofi,Expert Scientific Writer,Hyderābād,700000.0,"English, Project management, Content creation, Communication skills",4.0,Content Writer
Pi Techniques,Technical Writer - 3 to 5 Years Experience,Mumbai,450000.0,"English, Microsoft Office, Software development, Technical writing, Information architecture",3.1,Content Writer
WadzPay,Technical Writer,India,0.0,"Jira, CSS, Ansible, Journalism, English",2.9,Content Writer
Moltech Solutions,Technical Content Writer,Ahmedabad,450000.0,"React, SEO, Software development, Agile, Proofreading",4.1,Content Writer
Quest Global Technologies Ltd.,Technical Content Writer,Meerut,324000.0,"WordPress, Keyword research, Writing skills, English, Research",3.4,Content Writer
Arista Systems,CONTENT WRITER,Nāgpur,450000.0,"English, Technical writing, Proofreading, Communication skills",4.4,Content Writer
Panacorp Computer Academy,Technical Writer - Nagercoil,Nagercoil,192000.0,"Writing skills, English, Research, Technical writing, Research & development",,Content Writer
Impetus Technologies,Senior Content Writer,Indore,500000.0,"SEO, Content marketing, Analytics",4.1,Content Writer
Aureate Labs,Technical Content Writer,Surat,2880000.0,"Keyword research, Writing skills, Calendar management, Technical writing",4.7,Content Writer
Precedence Research,Content Writer,Pune,204000.0,"Creative writing, English, Research, Technical writing, Proofreading",,Content Writer
Fluentgrid,Technical Content Writer,Visakhapatnam,0.0,"Word processing, Journalism, English, Presentation skills, Interviewing",4.2,Content Writer
Siyana Info Solutions,Content Writer,Ahmedabad,450000.0,"Writing skills, English, Research, Analysis skills, Agile",4.2,Content Writer
Tech Prescient,Technical Content Writer,Pune,4800000.0,"English, Content creation, Product development, Technical writing, Content management",4.5,Content Writer
Trianz,Technical Writer,Bengaluru,550000.0,"Azure, Content management systems, English, AWS, Analysis skills",3.6,Content Writer
Crypto Mize,Political Writer,Delhi,0.0,"Keyword research, English, Microsoft Office, Information security, Chef",4.8,Content Writer
Infoblox,Technical Writer II,Bengaluru,550000.0,"Jira, Sourcing, Writing skills, Adobe Illustrator, English",4.5,Content Writer
Ultimez,Crypto Market Analyst And Writer,Remote,0.0,"Google Docs, Keyword research, Recruiting, Software development, SEO tools",4.0,Content Writer
I Love India,Content Writer (Technical),Bengaluru,0.0,"Search engines, English, Microsoft Office, PHP, HTML",,Content Writer
Kyzer Software,Technical Writer - Banking Domain Products,Mumbai,550000.0,"Microsoft Word, Writing skills, Git, English, Project management",3.7,Content Writer
SecureDomain Information Technology LLC,Content Writer,Cochin,438000.0,"Creative writing, Research, Content creation, Proofreading, Copywriting",,Content Writer
Butterfly Groups,Technical Content Writer,Coimbatore,1850000.0,"Creative writing, Writing skills, White papers, Product development, Software development",,Content Writer
ElMeasure,Content Writer,Bengaluru,0.0,"Microsoft Powerpoint, Microsoft Word, Google Docs, English, Research",4.2,Content Writer
Xybion Corporation,Technical Writer,Chennai,550000.0,"Microsoft Powerpoint, Microsoft Word, Adobe Photoshop, English, Microsoft Office",3.2,Content Writer
United Global Soft,Content Writer,Hyderābād,0.0,"UI, Communication skills",4.5,Content Writer
Mechsoft Digital Technologies,Content Writer,India,0.0,"Keyword research, Writing skills, Spark, English, Machine learning",3.9,Content Writer
Profito Interactive Pvt. Ltd.,Technical Content Writer,Noida,1800000.0,"Microsoft Word, Google Docs, Keyword research, Writing skills, English",4.6,Content Writer
"Arch Systems, LLC",Federal Proposal Writer/Manager,Remote,0.0,"Microsoft Powerpoint, Microsoft Word, Microsoft Excel, English, Microsoft Office",4.2,Content Writer
Jploft,Technical Content Writer,Jaipur,1194000.0,"SEO, Content marketing, Technical writing, Communication skills",4.5,Content Writer
Hindustan HR,Technical Writer,Nagercoil,138000.0,"English, Communication skills",,Content Writer
XenonStack,Sr Technical Content Writer,Mohali,237500.0,"Big data, Research, SEO, Organizational skills, Proofreading",3.4,Content Writer
Delhi Developer,Content Writer,Haryana,0.0,Writing skills,1.0,Content Writer
Peppermint Communications,Writers / Journalists / Asst. EditorWriters,Mumbai,350000.0,"Research, Adobe InDesign",2.6,Content Writer
Maheshwari Computers Pvt. Ltd.,Technical Writer with Design Expertise,Indore,360000.0,"Microsoft Word, Web design, Adobe Photoshop, CSS, Adobe Illustrator",,Content Writer
AHRC Pvt Ltd,Technical Content Writer,Jaipur,330000.0,"CSS, WordPress, Writing skills, Content management systems, Visio",,Content Writer
Veera steel,Technical Content Writer,India,510000.0,"Blogging, Writing skills, Visio, English, Research",,Content Writer
Nine Triangles Digital Pvt. Ltd.,Content Writer,Noida,390000.0,"Creative writing, Research, SEO, Technical writing, Proofreading",,Content Writer
Symtrax Software Pvt Ltd,Technical Writer,India,1200000.0,"Bilingual, EDI, English, Communication skills",,Content Writer
shree santosh marketing pvt ltd.,Document writer,India,0.0,"Google Docs, English, Microsoft Office, Technical writing, Typing",,Content Writer
Corporate Ranking,Technical Content Writer,Khurda,300000.0,"Writing skills, Visio, English, Technical writing, Proofreading",2.7,Content Writer
Plus91 Technologies Pvt Ltd,RFP Writer,Pune,850000.0,"Microsoft Powerpoint, Microsoft Word, Adobe Photoshop, Microsoft Excel, Writing skills",3.1,Content Writer
PurpleFront,Technical Writer,Bengaluru,600000.0,"Cloud infrastructure, Azure, Multilingual, Google Cloud Platform, AWS",3.9,Content Writer
Orion eSolutions Pvt.Ltd,Technical Content Writer,Mohali,720000.0,"WordPress, Keyword research, Creative writing, Writing skills, Content management systems",4.5,Content Writer
Travelomatrix,Technical Content Writer,Gurgaon,300000.0,"English, Research",,Content Writer
Crypto Mize,Malayalam Writer,Delhi,0.0,"Malayalam, English, Information security, Content creation, Chef",4.8,Content Writer
Aleph INDIA,Content writer,Delhi,0.0,Digital marketing,5.0,Content Writer
Crypto Mize,Technical Content Writer,Delhi,0.0,"Information security, Technical writing, Chef, Communication skills",4.8,Content Writer
StageBit,Technical Content Writer,Surat,450000.0,"Keyword research, English, SEO, Gujarati",2.9,Content Writer
iMatiz,Technical Content Writer,Bengaluru,500000.0,,3.3,Content Writer
Reltio,Lead Technical Writer,Bengaluru,600000.0,"Jira, Ant, XML, Adobe Captivate, Visio",4.0,Content Writer
SleekIT Technologies Pvt Ltd,Content Writer,Mohali,360000.0,"English, Research, Digital marketing, Communication skills",,Content Writer
Positiwise Software,Technical Content Writer,Ahmedabad,450000.0,English,5.0,Content Writer
CustomerLabs,Content Writer,Chennai,450000.0,"Web analytics, Social media management, English, Content marketing, Marketing automation",4.4,Content Writer
Infocom,Technical Content Writer,Cochin,1176000.0,"Operating systems, English, Microsoft Office, Administrative experience, Technical writing",3.8,Content Writer
Sanofi,Scientific Writer – Health Economics and Value Assessment (HEVA),Hyderābād,700000.0,"English, Project management, Content creation, Public health, Communication skills",4.0,Content Writer
Climbax Entertainment Private Limited,Content Writer,Gurgaon,180000.0,"Writing skills, English, Microsoft Office, Communication skills, Time management",,Content Writer
Vidya Mantra,Content Writer/Technical Writer,Noida,0.0,Analysis skills,3.8,Content Writer
Digital4design,Content Writer,Mohali,3240000.0,"Branding, Content management systems, Research, Proofreading, Communication skills",4.3,Content Writer
Dquip,Content Writer,Thāne,500000.0,"English, Communication skills",3.4,Content Writer
Cubic Logics India Pvt. Ltd.,Creative Content Writer,India,550000.0,"Microsoft Powerpoint, Keyword research, Creative writing, Writing skills, English",,Content Writer
QR Solutions,Content Writer,Tiruchchirāppalli,450000.0,"Writing skills, English, Research, AWS, Digital marketing",4.1,Content Writer
AiTrillion,Technical Content Writer,Indore,400000.0,"Search engines, Google Docs, WordPress, Writing skills, English",2.2,Content Writer
Elite Web Technologies,Content Writer,Chandigarh,0.0,"Creative writing, English, Communication skills, Time management",4.8,Content Writer
KEY IDEAS INFOTECH,Technical Content Writer – Intern,Gurgaon,0.0,"English, Research, Content creation, Digital marketing, SEO",3.8,Content Writer
cputek,Content Writer,Calcutta,174000.0,"Creative writing, Writing skills, English, Research, Content creation",,Content Writer
Aryson Technologies,Technical Content Writer,Noida,3000000.0,Keyword research,4.0,Content Writer
Stucare,Content Writer,Lucknow,400000.0,"Research, Digital marketing",3.0,Content Writer
PrimaFelicats Pvt. Ltd,Technical Content Writer,Noida,0.0,"TensorFlow, CSS, English, Research, Microsoft Office",,Content Writer
EverData,Technical Content Writer,Jaipur,3000000.0,Press releases,4.1,Content Writer
Semicon Media,Technical Content Writer,Jaipur,450000.0,"English, Microsoft Office, Technical writing, Agile, Sensors",,Content Writer
SentientGeeks,Content Writer,Calcutta,4800000.0,"Google Suite, Writing skills, Content management systems, Press releases, Microsoft Office",4.5,Content Writer
AdventSys Technologies,Content Writer,Bengaluru,0.0,"Test-driven development, English, Scrum, Agile, Communication skills",4.5,Content Writer
AiDash,Senior Technical Writer,Bengaluru,600000.0,"XML, Big data, English, Microsoft Office, Software development",3.1,Content Writer
WisewayTec,Technical Content Writer,Mohali,420000.0,"CRM software, WordPress, Git, English, Research",,Content Writer
Winfo Solutions,Content Writer - Marketing,Hyderābād,4800000.0,"Content management systems, Analysis skills, Project management, Content marketing, Communication skills",3.5,Content Writer
AIS Technolabs,Non Technical Content Writer,Ahmedabad,450000.0,"Google Suite, English, Microsoft Office, Communication skills, Marketing",4.3,Content Writer
Bytes Technolab,Technical Content Writer,Ahmedabad,4200000.0,"Blogging, WordPress, Keyword research, Content management systems, English",4.4,Content Writer
SAK INFORMATICS,Technical Content Writer,Hyderābād,138000.0,"Writing skills, English, Research, Analysis skills, SEO",,Content Writer
Lester Inc,Technical Content Writer,Navi Mumbai,250000.0,,3.1,Content Writer
QuEST Global,Technical document writer Expert (Cortona),Bengaluru,800000.0,Mechanical knowledge,3.7,Content Writer
ChargePoint,Staff Technical Writer,Bengaluru,550000.0,"Jira, Photography, Microsoft Word, Adobe Photoshop, Microsoft Excel",3.3,Content Writer
Mr N Mrs Pet,Content Writer,Jaipur,390000.0,"Keyword research, Writing skills, Journalism, Content creation, SEO",,Content Writer
Market Research Future,CONTENT WRITER,Pune,4200000.0,"Writing skills, Content management",3.9,Content Writer
ServiceNow,Senior Technical Writer,Hyderābād,600000.0,"XML, Content development, ServiceNow",4.4,Content Writer
Beverse,Academic Content Writer,Bengaluru,300000.0,"English, Microsoft Office, Proofreading",,Content Writer
EIE Instruments,Technical Content Writer,Ahmedabad,4800000.0,"English, Microsoft Office, Gujarati, Typing, Hindi",3.9,Content Writer
PrimaThink Technologies,Technical Content Writer,Amravati,500000.0,"Social media marketing, Social media management, Content marketing, Technical writing, B2B Marketing",3.8,Content Writer
ProMobi Technologies,Technical Content Writer,Pune,500000.0,"XML, Technical support, Software development, UI, Communication skills",4.1,Content Writer
Wells Fargo,Senior Procedure Writer,Hyderābād,600000.0,"Jira, Microsoft Powerpoint, Microsoft Excel, Writing skills, Visio",3.6,Content Writer
Nuacem AI,Content Writer,Hyderābād,3600000.0,"WordPress, Keyword research, Writing skills, Content management systems, English",4.5,Content Writer
Barry Wehmiller Companies Inc,Training Content Writer,Chennai,350000.0,"Enterprise Software, Writing skills, LMS, Instructional design",3.4,Content Writer
Crypto Mize,Creative Writer,Delhi,0.0,"Microsoft Powerpoint, Blogging, Google Suite, Creative writing, Research",4.8,Content Writer
Netskope,Sr. Staff Technical Writer,Bengaluru,0.0,"English, WAN, Computer networking, Technical writing, Communication skills",4.1,Content Writer
Cloudaeon Pvt Ltd,Technical Content Writer,India,276000.0,"Writing skills, English, Microsoft Office, Project management, SEO",,Content Writer
Aurigo,Proposal Writer,India,0.0,"Microsoft Word, Microsoft Excel, Enterprise Software, English, Graphic design",4.6,Content Writer
CreativeWebLogix,Technical Content Writer,Noida,400000.0,"Web design, WordPress, PHP, SEO",,Content Writer
"LotusFlare, Inc.",Technical Writer,Pune,600000.0,"Enterprise Software, iOS, Git, Usability, Technical writing",4.3,Content Writer
Orion eSolutions,Technical Content Writer,Mohali,4200000.0,"WordPress, Keyword research, Creative writing, Content management systems, English",4.5,Content Writer
Jploft Solutions Pvt.Ltd.,Content Writer,India,4680000.0,"Writing skills, English, Research, Content creation, Proofreading",4.5,Content Writer
VERTS Services India,Content Writer,India,0.0,,4.0,Content Writer
Geek Shastra Technologies,Technical Content Writer,India,180000.0,"Creative writing, Proofreading",,Content Writer
Version systems Pvt. Ltd.,Content Writer,Rājkot,1200000.0,"Creative writing, Writing skills, English, Proposal writing, Technical writing",4.1,Content Writer
Headphone Zone,CONTENT WRITER,Mumbai,450000.0,,2.5,Content Writer
Basecamp Startups,Content Manager / Sr. Content Writer,Indore,450000.0,"Keyword research, Content marketing",3.1,Content Writer
Identixweb Limited,Content Writer,Surat,3384000.0,"Keyword research, Writing skills, English, Technical writing, Proofreading",4.7,Content Writer
webart softech,content Writer,Panchkula,2520000.0,"Keyword research, Research, SEO, UX, Technical writing",3.8,Content Writer
Synclovis Systems,Content Writer,Bengaluru,550000.0,"Writing skills, Research, Content creation, SEO, Organizational skills",4.6,Content Writer
Rajarshi Solutions,Technical Content Writer,Vadodara,300000.0,"Writing skills, English, Research, Project management, SEO",,Content Writer
Motionzen Services,Technical Writer for Software Company,Chennai,450000.0,"Microsoft Office, Technical writing, Communication skills",,Content Writer
ServerGuy,Technical Content Writer,Noida,4800000.0,"WordPress, Keyword research, Content management systems, English, Research",3.8,Content Writer
ReInvent Systems,Technical / Content Writer,Pune,0.0,"Content creation, UI, jQuery",,Content Writer
Thriam Group of Industries,Technical Content Writer,India,258000.0,"Writing skills, English, SEO, Organizational skills, Technical writing",,Content Writer
Newgen KnowledgeWorks,Legal Content Writer,India,0.0,"Microsoft Powerpoint, Microsoft Word, Microsoft Excel, Research, Microsoft Office",3.6,Content Writer
vinove,C-Tel Content Writer,Noida,0.0,"Azure, Waterfall, XML, Writing skills, DevOps",3.3,Content Writer
DataCouch Pvt. Ltd.,Senior Technical Content Writer,Mohali,420000.0,"Microsoft Word, Google Docs, WordPress, Writing skills, English",,Content Writer
Crypto Mize,Legal Writer,Delhi,0.0,"Microsoft Powerpoint, Microsoft Word, Microsoft Excel, English, Research",4.8,Content Writer
Invoidea Technologies,Content Writer,India,0.0,"Creative writing, Research, Microsoft Office, Proofreading",4.5,Content Writer
Appsinvo,Technical Content Writer,Noida,4800000.0,"Keyword research, English, Microsoft Office, Google Analytics, Communication skills",4.4,Content Writer
Jai Infoway,Senior Technical Writer,India,0.0,"CSS, Content creation, Technical writing, APIs, HTML",4.6,Content Writer
Zymr,Content Writer,Pune,0.0,"English, SEO",3.5,Content Writer
Mobishastra Technologies Private Limited,Creative Content Writer,Gurgaon,372000.0,"PaaS, Graphic design, SEO, Proofreading, SaaS",,Content Writer
Elysium Technologies Private Limited,Technical Writer,India,168000.0,"Writing skills, Research, Technical writing, Communication skills",,Content Writer
PROGILENCE Capability Development,Technical Content Writer – Education and Training,Gurgaon,400000.0,"Microsoft Powerpoint, Microsoft Word, Microsoft Excel, English, Microsoft Office",2.0,Content Writer
Helpful insight Pvt Ltd,Technical Content Writer,India,330000.0,"Creative writing, Writing skills, Visio, English, Research",,Content Writer
Resulticks,Technical Writer,Chennai,800000.0,"Microsoft Word, Word processing, Microsoft Office, .NET, Product development",4.2,Content Writer
SANTA MONICA STUDY ABROAD PRIVATE LIMITED,SOP Content Writer ( Females),Cochin,318000.0,"English, Microsoft Office, Project management, Content development, Technical writing",,Content Writer
Limonade Technologies,communication/technical writer intern,Tamil Nadu,0.0,"Microsoft Powerpoint, Microsoft Word, Microsoft Outlook, English, Microsoft Office",,Content Writer
Rewathi Innovations,Technical Content Writer,Jaipur,450000.0,"English, Local language, Computer skills, A/B testing, Communication skills",4.6,Content Writer
GuiRes Solutions Pvt Ltd,Medical Writer,India,330000.0,"Data science, Medical terminology, Communication skills",,Content Writer
MadvIT Solutions,Technical Content Writer,Noida,500000.0,"Buffer, Social media management, Keyword research, Writing skills, Digital marketing",,Content Writer
Infibusiness Solution,Content Writer,Vadodara,3000000.0,Marketing,4.2,Content Writer
Zuan Technologies,Content Writer,Chennai,1200000.0,"Research, Content management, Proofreading, Copywriting",4.6,Content Writer
Bitrix Infotech,Content Writer,Surat,450000.0,"English, Communication skills",2.8,Content Writer
Medtronic,Senior Clinical Evaluation Medical Writer,India,0.0,"Diagnostic evaluation, Project management, Product development, Communication skills",3.8,Content Writer
Webomaze Technologies,Content Writer - 1+ Year Experience,India,0.0,"Google Docs, Keyword research",3.8,Content Writer
Softlogic Systems,Content Writer,Chennai,0.0,"Microsoft Powerpoint, Microsoft Word, Google Docs, Microsoft Excel, English",4.4,Content Writer
Overseas Cyber Technical Services (OCTS),Creative Content Writer,Kāraikkudi,4200000.0,"Blogging, Keyword research, English",5.0,Content Writer
Wroffy Technologies,Technical Content Writer,Gurgaon,500000.0,"Microsoft Word, Keyword research, Mobile applications, Confluence, Marketing automation",4.0,Content Writer
SoftGetix,Content Writer,India,0.0,"Keyword research, Creative writing, Writing skills, Content management systems, English",4.6,Content Writer
Moonhive,Technical Content Writer,Kerala,0.0,"English, Research, Digital marketing, SEO, Leadership",2.6,Content Writer
Vtiger,Content Writer,Bengaluru,2400000.0,"Google Suite, Writing skills, Adobe Illustrator, English, Microsoft Office",4.0,Content Writer
Cyber Help India,Content Writer,Shiliguri,500000.0,"Research, Digital marketing",5.0,Content Writer
WealthSpectrum,Technical Content Writer,Ahmedabad,450000.0,,,Content Writer
SentinelOne,Senior Technical Writer,Bengaluru,0.0,"Knowledge management, XML, English, Virtualization, SDKs",4.4,Content Writer
Core Competency Group,Technical Instructional Designer/ Content Writer,Gurgaon,750000.0,"Mechanical engineering, Scripting",2.9,Content Writer
NC global media,Content writer,Chennai,282000.0,"Content management systems, English, Research, SEO, Communication skills",,Content Writer
