company_name,job_role,job_location,salary_pa,skills,company_rating,standardized_job_role
Insight Business Reengineering,Senior Data Engineer - Snowflake,India,1150000.0,"Performance tuning, Azure, English, Databases, SQL",,Data Scientist
Visa,"Staff Data Engineer, Data Engineering",Bengaluru,700000.0,"CI/CD, Program management, Big data, Software deployment, Git",3.9,Data Scientist
Amgen,MDM Data Engineer,Hyderābād,700000.0,"SAFe, Oracle, SAP, Data structures, Data analysis skills",4.1,Data Scientist
bp,Data Engineer,Pune,2400000.0,"CI/CD, Data modeling, Azure, Internet of things, DevOps",3.9,Data Scientist
bp,Staff Data Engineer,Pune,2400000.0,"C#, .NET, Java, SQL, OOP",3.9,Data Scientist
Angel broking,SRE2 -Data Engineering,India,0.0,"Big data, Spark, Databases, SQL, AWS",4.4,Data Scientist
bp,Senior Data Engineer,Pune,2400000.0,"CI/CD, C#, .NET, Java, SQL",3.9,Data Scientist
CPP Investments,"Engineer, Data Engineers",Mumbai,650000.0,"CI/CD, Cassandra, Big data, DevOps, Spark",3.2,Data Scientist
e24 Technologies Pvt Ltd.,Senior Data Engineer,Chennai,1000000.0,"TensorFlow, Data modeling, Azure, Big data, Spark",,Data Scientist
NCS Pte Ltd.,Senior Data Engineer,India,0.0,"Azure, XML, Big data, Spark, Git",3.3,Data Scientist
Golden Eagle IT Technologies,Sr. Data Scientist,Indore,550000.0,"TensorFlow, Image processing, Azure, Computer vision, Big data",4.1,Data Scientist
CPP Investments,"Lead Data Engineer, Technology & Data",Mumbai,650000.0,"CI/CD, Cassandra, Big data, DevOps, Spark",3.2,Data Scientist
Visa,Data Engineer - Sr. Consultant,Bengaluru,700000.0,"TensorFlow, CI/CD, Operating systems, Security analysis, React",3.9,Data Scientist
Visa,Staff Data Engineer (Open source committers/contributors),Bengaluru,700000.0,"Go, Kubernetes, Ansible, DevOps, Spark",3.9,Data Scientist
Drivetrain AI,Software Engineer (Data Engineering),Remote,0.0,"Computer science, Big data, Spark, SQL, Data warehouse",4.8,Data Scientist
HSBC,Data Engineer/Senior Software Engineer,Hyderābād,750000.0,"DB2, Data structures, SQL, Agile, Communication skills",3.9,Data Scientist
JPMorganChase,Software Engineer II Data Engineer,Hyderābād,850000.0,"CI/CD, Oracle, Software troubleshooting, Encryption, Data analysis skills",4.0,Data Scientist
Imurgence,Data Science/ ML /AI Technical Code Writer for Blogs,Remote,0.0,"Data science, AI",4.0,Data Scientist
Infosys,Data Specialist - (Infosys Knowledge Institute),Bengaluru,600000.0,"Writing skills, Research, APIs, Agile, AI",3.6,Data Scientist
