company_name,job_role,job_location,salary_pa,skills,company_rating,standardized_job_role
"Stonewain Systems, an EquiLend Company",Senior PostgreSQL Database Administrator (DBA),Chandigarh,0.0,"Data modeling, Databases, Database administration, AWS, Database management",,Data Base Administrator
HSK IT Solutions,Database Administartor,Hyderābād,0.0,,3.7,Data Base Administrator
AppSierra Solutions Private Limited,SQL Server DBA,Bengaluru,900000.0,"Crystal Reports, Operating systems, Microsoft SQL Server, Windows, SQL",,Data Base Administrator
Zensar Technologies,MS SQL Server DBA,India,0.0,"Microsoft Windows Server, Disaster recovery, Microsoft SQL Server, SSRS, Windows",3.9,Data Base Administrator
StayinFront India Pvt Ltd,SQL DBA,Gāndhīnagar,450000.0,"Database development, Microsoft SQL Server, SQL, Database administration, Clustering",3.3,Data Base Administrator
Worldpay,Database Developer(7+ years of experiencein PL/SQL) Pune,Pune,770000.0,"Performance tuning, Oracle, SQL, Agile, PL/SQL",3.9,Data Base Administrator
MBI Digital,Hadoop Database Administrator (Support role),India,0.0,"Performance tuning, Oracle, Big data, Disaster recovery, Microsoft SQL Server",2.9,Data Base Administrator
Planck Epoch Institute of Professional Studies,Database Administration Trainee,Calicut,90000.0,"Databases, SQL, Database administration, Analysis skills, Database management",,Data Base Administrator
Deyo Infotech,MySQL DBA,Ālangulam,216000.0,"Communication skills, MySQL",,Data Base Administrator
JLL,Senior Database Administrator,Aurangābād,720000.0,"Performance tuning, Azure, Oracle, Maximo, DB2",3.8,Data Base Administrator
Soul of Pluto Tech,Database Admin,Hyderābād,615000.0,MySQL,3.6,Data Base Administrator
LanceTech Solutions Pvt Ltd,Senior DBA,Delhi,1500000.0,"Performance tuning, Azure, Software troubleshooting, MongoDB, Microservices",4.6,Data Base Administrator
Rite Software Solutions & Services (IN),MS SQL DBA,Bengaluru,650000.0,"Cloud infrastructure, Microsoft SQL Server, SQL",4.1,Data Base Administrator
Bosch Group,Database Consultant,Bengaluru,812500.0,"Power BI, Azure, Oracle, Pentaho, DevOps",4.1,Data Base Administrator
Rite Software Solutions & Services (IN),MS SQL DBA Consultant,Hyderābād,431500.0,"Cloud infrastructure, Microsoft SQL Server, SQL, Unit testing, PL/SQL",4.1,Data Base Administrator
Arya Omnitalk,PostgreSql Administrator,Pune,450000.0,"SQL, PostgreSQL, Linux, PL/SQL, High availability",3.7,Data Base Administrator
Infosys,DB2 Database Admin,Bengaluru,413500.0,"Oracle, DB2, Database administration, Analysis skills, Scripting",3.6,Data Base Administrator
Terralogic Vietnam,Database Activity Monitoring (DAM),Mumbai,0.0,,3.4,Data Base Administrator
Mafiree,MySQL DBA,Bengaluru,960000.0,"Performance tuning, Data mining, PHP, Perl, Scripting",,Data Base Administrator
Cognizant,Core Database Administrator,Calcutta,0.0,"Ansible, Weblogic, ITIL, Scrum, Agile",3.7,Data Base Administrator
Anblicks,SQL Server DBA,Hyderābād,641000.0,"DevOps, Encryption, Microsoft SQL Server, Git, Relationship management",4.4,Data Base Administrator
SFJ Business solutions,DBA,Mumbai,600000.0,"Node.js, SQL, Database administration, Redis, Linux",4.5,Data Base Administrator
Vitech,Postgres Database Developer,Hyderābād,525000.0,"System administration, Databases, SQL, Analysis skills, PostgreSQL",4.9,Data Base Administrator
Kuber and Company,Sr. SQL DBA,Remote,0.0,"Performance tuning, Azure, Oracle, SAP HANA, DB2",,Data Base Administrator
Oracle,TAM - Oracle DBA,Navi Mumbai,589000.0,"Oracle, PaaS, IaaS",3.8,Data Base Administrator
DEME,Data Base Administrator,India,0.0,"Performance tuning, DevOps, Encryption, Disaster recovery, Microsoft SQL Server",4.3,Data Base Administrator
Paymentology,PostgreSQL Database Administrator,Haryana,0.0,"Azure, Ansible, Encryption, Microsoft SQL Server, Git",4.6,Data Base Administrator
Barclays,Database Engineer,Pune,579500.0,"Jira, CI/CD, Performance tuning, Azure, Kubernetes",3.9,Data Base Administrator
Saks,"Assistant Manager, Database Administration",Bengaluru,501500.0,"Data center experience, Azure, Oracle, DB2, Microsoft SQL Server",3.8,Data Base Administrator
Contentstack,Senior Database Administrator II,Bengaluru,518000.0,"Performance tuning, Elasticsearch, Data modeling, Azure, NoSQL",4.2,Data Base Administrator
Infotel UK,Adabas Database,Chennai,0.0,"Performance tuning, Database administration, Analysis skills",3.5,Data Base Administrator
Jade Global,Junior Oracle DBA,Pune,511000.0,"Oracle, SQL, Database design, Database management",3.7,Data Base Administrator
Appsierra,SQL Server DBA Support,Hyderābād,2118000.0,"Crystal Reports, Operating systems, Microsoft SQL Server, Windows, SQL",3.9,Data Base Administrator
InSphere Solutions,Senior Database Administrator,Delhi,0.0,"Management, Git, SVN, PostgreSQL, Organizational skills",4.6,Data Base Administrator
Datavail,Senior Associate Database Administrator,Bengaluru,617500.0,"DB2, Database administration, COBOL",3.7,Data Base Administrator
Noduco,Sr. Database Administrator,Noida,660500.0,"Performance tuning, Data modeling, Oracle, Database development, Data analysis skills",4.6,Data Base Administrator
HIRD Services Pvt ltd,Oracle DBA-Exadata / Mumbai,Mumbai,2500000.0,"Oracle, Microsoft SQL Server, SQL",,Data Base Administrator
Landis+Gyr,Technical lead - Database Administrator (Postgres SQL),Noida,516500.0,"Performance tuning, Azure, Oracle, Incident management, Ansible",3.7,Data Base Administrator
"ABC Financial Services, Inc.",Lead Oracle Database Administrator,Hyderābād,588000.0,"Knowledge management, TCP, Azure, Oracle, NFS",4.0,Data Base Administrator
Crayontek,SQL Server DBA,Bengaluru,0.0,"Performance tuning, Data modeling, Microsoft SQL Server, Databases, SQL",,Data Base Administrator
Nuware Systems,MS SQL DBA,Bengaluru,551500.0,"Microsoft SQL Server, Windows, SQL",4.2,Data Base Administrator
Accenture,Microsoft SQL Server Database Administration-Software Development Engineer,Hyderābād,0.0,"Microsoft SQL Server, Database administration, PostgreSQL",3.8,Data Base Administrator
Phygital Insights,Database Admin,Mumbai,0.0,"Encryption, Database administration, PostgreSQL",4.9,Data Base Administrator
ION,Senior Database Administrator,Noida,382500.0,"Performance tuning, Azure, Oracle, Ansible, DB2",3.3,Data Base Administrator
Ekvayu Tech Pvt Ltd,DBA,India,500000.0,"CI/CD, Encryption, MongoDB, Analysis skills, Database management",,Data Base Administrator
Ikrux,No SQL DataBase Admin,Bengaluru,528500.0,"Elasticsearch, Encryption, NoSQL, MongoDB, Analysis skills",4.5,Data Base Administrator
Nexus pro services,Technical- DBA- MYSQL,Delhi,425000.0,"SQL, Database administration, Analysis skills, Communication skills, MySQL",,Data Base Administrator
Lucini&Lucini Communications,MySQL Data Base Administrator,Bengaluru,542000.0,"English, Databases, SQL, PHP, Scripting",3.7,Data Base Administrator
EVERSANA,Sr Database Administrator,Pune,641500.0,"Microsoft Windows Server, Power BI, Software troubleshooting, Customer service, DevOps",3.5,Data Base Administrator
Onevega system India Pvt Ltd,Sr. SQL DBA,Bengaluru,1500000.0,"Oracle, Microsoft SQL Server, Databases, SQL, Database administration",,Data Base Administrator
Virtusa,Postgres DBA,Bengaluru,896000.0,"SQL, PostgreSQL",3.7,Data Base Administrator
Mex Exhibitions,Manager-Database,Delhi,0.0,"Microsoft Excel, Process improvement, Communication skills",4.0,Data Base Administrator
Oracle,Senior Consultant - Oracle Database Administrator,Bengaluru,627500.0,"Operating systems, Oracle, OS Kernels, Mentoring, Customer support",3.8,Data Base Administrator
Corsearch,Senior Database Administrator,Mumbai,481500.0,"CI/CD, Performance tuning, Azure, Oracle, Cassandra",4.1,Data Base Administrator
Photon,"Senior DBA- Lead Database Administrator- Chennai, TN",Chennai,542500.0,"Database administration, PostgreSQL",4.0,Data Base Administrator
NTT DATA,Technical Specialist Database administrator- Oracle,Chennai,491500.0,"Oracle, Relational databases, Encryption, Microsoft SQL Server, Application development",3.8,Data Base Administrator
Parahit Technologies,MySQL DBA,Delhi,0.0,MySQL,3.7,Data Base Administrator
Ace Software,Sr. Oracle Database Administrator,Mumbai,498000.0,"Performance tuning, Operating systems, Oracle, Database development, Windows",,Data Base Administrator
Triumph Ladders Pvt. Ltd.,MySQL DBA,Bengaluru,600000.0,"Performance tuning, MongoDB, SQL, Database design, Database administration",5.0,Data Base Administrator
Vigilant Technologies,SQL DBA,Hyderābād,512000.0,"Performance tuning, Cloud infrastructure, Azure, Software troubleshooting, Encryption",4.0,Data Base Administrator
Refulgence,"Server Administrator (MCSE, RHCE, DBA)",Chennai,505000.0,"Windows, Linux",3.7,Data Base Administrator
Medicodio,Database Admin,Bengaluru,600000.0,"Authentication, Performance tuning, Encryption, Disaster recovery, SQL",,Data Base Administrator
Luxoft,MYSQL DBA,India,0.0,"Performance tuning, IT service management, English, Databases, Database administration",3.7,Data Base Administrator
Purple Drive Technologies,Sybase DBA,Bengaluru,1195000.0,"Disaster recovery, SQL, Scripting, Sybase, High availability",3.6,Data Base Administrator
Hashone Careers,PostgreSQL DBA,Hyderābād,1000000.0,"Data modeling, SQL, Database administration, AWS, PostgreSQL",,Data Base Administrator
Velocida private limited,Senior Oracle DBA,Hyderābād,1349500.0,"Cloud infrastructure, Oracle, Databases, Scripting, Software development",5.0,Data Base Administrator
iSOCRATES,Senior Database Administrator,India,0.0,"Jira, Cloud infrastructure, Azure, Business intelligence, DevOps",3.3,Data Base Administrator
Iksha Labs,PostgreSQL DBA,Gurgaon,1000000.0,"Performance tuning, Load balancing, Disaster recovery, Databases, Database administration",,Data Base Administrator
Cloud Kinetics,Database Admin,Chennai,430000.0,"Data modeling, Software troubleshooting, Database design, Database administration, Database management",3.8,Data Base Administrator
Datamini Technologies,Database Developer & Admin,India,0.0,"Oracle, NoSQL, Databases, SQL, Database design",4.0,Data Base Administrator
NTT DATA,Database Administrator - MSSQL DBA - L2,Mumbai,481500.0,"Performance tuning, Azure, Oracle, Software troubleshooting, Encryption",3.8,Data Base Administrator
CDM Smith,Senior Database Administrator,Chennai,497500.0,"Oracle, Visual Basic, Microsoft SQL Server, Oracle EBS, SSRS",4.1,Data Base Administrator
NCR Atleos,Database Engineer III,Gurgaon,670000.0,"Performance tuning, Cloud infrastructure, Azure, Oracle, Software troubleshooting",3.4,Data Base Administrator
WTW,DBA,Bengaluru,657500.0,"Microsoft Windows Server, Oracle, Microsoft SQL Server, Windows, SQL",3.9,Data Base Administrator
Excelencia Itech Consulting Pvt Ltd,Senior Application Database Administrator,Chennai,440000.0,"Performance tuning, Azure, Database development, Project planning, Enterprise Software",4.5,Data Base Administrator
CGI,Postgres DBA,Bengaluru,557000.0,"Oracle, PostgreSQL, MySQL",3.8,Data Base Administrator
Purple Drive Technologies,Oracle DBA,India,552000.0,"Performance tuning, Oracle, Disaster recovery, SQL, Database administration",,Data Base Administrator
Ritchoiz,MySQL DBA,Cochin,318000.0,MySQL,,Data Base Administrator
Vidushi Infotech,Oracle DBA,India,0.0,"Performance tuning, Cloud infrastructure, Oracle, Databases, SQL",3.1,Data Base Administrator
MNJ Software,Senior MongoDB Database Administrator,Remote,0.0,"Big data, NoSQL, English, MongoDB, Java",3.6,Data Base Administrator
Kyndryl,Oracle Database Administration (Golden Gate),Greater Noida,549500.0,"Performance tuning, Oracle, Database administration, Communication skills",3.9,Data Base Administrator
Right Infotech Solutions,Senior MySQL Database Administrator,Delhi,0.0,"JBoss, Cloud infrastructure, English, Java, AWS",2.7,Data Base Administrator
Infosys,Peoplesoft DBA,Bengaluru,413500.0,"SSO, Oracle, Windows, Database administration, Analysis skills",3.6,Data Base Administrator
walnut softech private limited,Oracle DBA,India,1140000.0,"Oracle, Go, Writing skills, Java, SQL",,Data Base Administrator
Photon,Oracle DBA,Bengaluru,582500.0,"Performance tuning, Oracle, Software troubleshooting",4.0,Data Base Administrator
Radiss Tech Services,MySQL DBA,Andhra Pradesh,0.0,"openSUSE, Scripting, Linux, LAMP stack, MySQL",3.5,Data Base Administrator
WOWinfotech,SQL Developer 1+ years,Nashik,4440000.0,"Performance tuning, Microsoft SQL Server, SSRS, SQL, Database design",3.8,Data Base Administrator
Speridian,MS SQL DBA,Bengaluru,946500.0,"Performance tuning, Disaster recovery, Microsoft SQL Server, SQL, Database design",4.0,Data Base Administrator
Sakshi Infotech Solution,Database Engineer,Mumbai,1500000.0,"Performance tuning, Azure, Cassandra, Software troubleshooting, Kubernetes",3.7,Data Base Administrator
Landis+Gyr,Technical lead - Database Administrator (PostgreSQL),Noida,516500.0,"Performance tuning, Azure, Oracle, Incident management, Ansible",3.7,Data Base Administrator
MNJ Software,Team Member (SQL DBA),Remote,0.0,"Oracle, Data structures, Microsoft SQL Server, English, .NET",3.6,Data Base Administrator
Renovision Automation Services Pvt. Ltd,MySQL DBA,Mumbai,4800000.0,"Azure, Microsoft SQL Server, MongoDB, SQL, Database administration",3.7,Data Base Administrator
HSBC,Database admin/Consultant Specialist,Hyderābād,490500.0,"Jira, Performance tuning, Oracle, SQL, Confluence",3.9,Data Base Administrator
Jash Job Service,PL/SQL Developer,India,400000.0,"Git, SQL, Database administration, PostgreSQL, PL/SQL",,Data Base Administrator
JRK Infotech,Oracle DBA L2,Navi Mumbai,580000.0,Oracle,3.9,Data Base Administrator
Cambridge Technology Enterprises (CTE),Oracle DBA,Bengaluru,520000.0,"Performance tuning, Oracle, Solaris, Windows, SQL",4.0,Data Base Administrator
Shree Group,"SQL, PL/SQL Developer",India,600000.0,"Software deployment, Git, SQL, Database administration, AWS",,Data Base Administrator
Savantys Solutions,SQL DBA,Bengaluru,629500.0,"Jira, CI/CD, Performance tuning, Azure, Load balancing",5.0,Data Base Administrator
PTS Consulting Services,Database Developer,Calcutta,3312000.0,"Performance tuning, Azure, Oracle, Cassandra, Encryption",4.0,Data Base Administrator
NTT DATA,Database Admin Advisor,Noida,491500.0,"Performance tuning, Oracle, Disaster recovery, Quality management, Windows",3.8,Data Base Administrator
AAS Technosoft,DBA,Delhi,0.0,,,Data Base Administrator
Kyndryl,Mongo Lead Database Administrator,Mumbai,540000.0,"Microsoft Windows Server, Cloud infrastructure, Azure, MongoDB, Windows",3.9,Data Base Administrator
Salus Technologies,Sr. Database Developer SQL/mySQL/mariaDB,Pune,453000.0,"Microsoft Windows Server, Database development, Microsoft SQL Server, Databases, SQL",2.6,Data Base Administrator
SK International,Oracle DBA,Mumbai,752000.0,"Oracle, Microsoft SQL Server, Database administration, MySQL",3.2,Data Base Administrator
Athena Global Technologies,MSSQL Server DBA,Hyderābād,565000.0,"Microsoft Windows Server, Azure, Operating systems, Microsoft SQL Server, Windows",3.9,Data Base Administrator
"Kochasoft, Inc","Oracle DBA (Chennai, Pune)",India,1500000.0,"Microsoft Windows Server, Performance tuning, Azure, Oracle, Disaster recovery",,Data Base Administrator
OCULUSIT,SQL DBA Engineer,Gurgaon,450000.0,"JBoss, Power BI, Azure, Microsoft SQL Server, SQL",3.9,Data Base Administrator
TechMojo Solutions,MYSQL DBA (Work from Office),Hyderābād,3816000.0,"Cassandra, NoSQL, MongoDB, Databases, SQL",4.1,Data Base Administrator
Antrorse,DATABASE ADMIN,Bengaluru,558500.0,"iOS development, iOS, Java, OOP, Analysis skills",4.5,Data Base Administrator
Figment Global Solutions,Database Developer (ORACLE DBA),Nāgpur,600000.0,"Microsoft Windows Server, Oracle, Windows, SQL, Quality assurance",2.2,Data Base Administrator
Pi Techniques,Database Admin - 4 to 6 Years Experience,Mumbai,321500.0,"Microsoft Windows Server, Performance tuning, Disaster recovery, Microsoft SQL Server, Windows",3.1,Data Base Administrator
Kyndryl,Sybase SQL,Bengaluru,945000.0,"Incident management, Lean, SQL, Analysis skills, Project management",3.9,Data Base Administrator
3Di Systems,PLSQL / PostgreSQL Developer,Navi Mumbai,453000.0,"SQL, PostgreSQL, PL/SQL",4.0,Data Base Administrator
Accelya,Specialist Database Administration - PostgreSQL,Mumbai,2820000.0,"Cassandra, Salt, Ansible, MongoDB, Database administration",3.7,Data Base Administrator
Sanmina Corporation,Senior Oracle Database Administrator,Chennai,405000.0,"Oracle, Database administration",3.4,Data Base Administrator
"Qualifacts Systems, Inc.",Staff Database Admin,Vadodara,562500.0,"Performance tuning, Encryption, Microsoft SQL Server, SSRS, SQL",3.6,Data Base Administrator
Pyramid Global Technologies,Database Admin/Build Eng,Mohali,0.0,"Microsoft Windows Server, Operating systems, Oracle, Microsoft SQL Server, Solaris",5.0,Data Base Administrator
Ingrain Systems Inc.,Infrastructure DBA MongoDB,Hyderābād,450000.0,"Software troubleshooting, DevOps, MongoDB, Databases, Database administration",4.6,Data Base Administrator
Luxsh solution pvt ltd,Sr Oracle DBA,Vadodara,822000.0,"Oracle, Relational databases, Windows, SQL, Scripting",,Data Base Administrator
SymphonyAI,Oracle DBA,Bengaluru,1500000.0,"Performance tuning, Cloud infrastructure, Azure, Oracle, Node.js",3.5,Data Base Administrator
"TWO95 International, Inc",Oracle EBS DBA(database),India,0.0,"Authentication, Oracle, Relational databases, Oracle EBS, Weblogic",4.5,Data Base Administrator
Simple Logic IT,Oracle DBA,Mumbai,0.0,"Performance tuning, Oracle, Analysis skills, High availability",4.2,Data Base Administrator
"Stefanini, Inc",IMS DBA,Pune,746500.0,"Database administration, CICS, Analysis skills, AI",3.8,Data Base Administrator
M Tech Soft,Microsoft SQL DBA,Gurgaon,4032000.0,"Azure, Node.js, Disaster recovery, Microsoft SQL Server, SQL",3.9,Data Base Administrator
Simple Logic IT,PostgreSQL DBA,India,0.0,"Azure, Oracle, SQL, AWS, PostgreSQL",4.2,Data Base Administrator
Rohin Infotech Pvt Ltd.,PostgreSQL DBA,Delhi,420000.0,"Performance tuning, Azure, Oracle, Encryption, Disaster recovery",,Data Base Administrator
Squid Technologies,MS SQL Server DBA,India,0.0,"Microsoft Windows Server, Statistics, Performance tuning, Disaster recovery, Microsoft SQL Server",3.0,Data Base Administrator
Infosys,Oracle Apps and Core DBA,Bengaluru,413500.0,"Oracle, Node.js, Disaster recovery, Oracle EBS, Weblogic",3.6,Data Base Administrator
Hewlett Packard Enterprise,MSSQL Server DBA,Bengaluru,755500.0,"Performance tuning, Azure, Data analysis skills, Disaster recovery, Microsoft SQL Server",4.2,Data Base Administrator
Tekion,Database Engineer I,Bengaluru,0.0,"CI/CD, Azure, NoSQL, Git, MongoDB",3.4,Data Base Administrator
Data Ingenious Global,Database Server/ System Administrator (Oracle Certified),Jaipur,212000.0,Oracle,3.2,Data Base Administrator
Qualitest,OCI Analyst/Developer - Database,Bengaluru,225500.0,"Performance tuning, Cloud infrastructure, Azure, Oracle, Ansible",3.4,Data Base Administrator
Barclays,Senior Database Engineer,Pune,579500.0,"Jira, CI/CD, Performance tuning, Azure, Kubernetes",3.9,Data Base Administrator
Radcom,DBA Support,Delhi,0.0,"TCP, Oracle, Big data, English, SQL",3.9,Data Base Administrator
Sapiens,Associate Consultant - DBA,Bengaluru,828000.0,"Azure, Encryption, Disaster recovery, PaaS, SQL",3.6,Data Base Administrator
Hotel Simsan,Oracle DBA,Chennai,656500.0,"Telugu, Oracle, Multilingual, Tamil, Database management",,Data Base Administrator
LSEG (London Stock Exchange Group),Database & DevOps Engineer,Bengaluru,763000.0,"Data modeling, Cloud infrastructure, System administration, Ansible, Relational databases",3.8,Data Base Administrator
PradeepIT Consulting Services,DBA (MS SQL server),Bengaluru,424500.0,"Azure, Microsoft SQL Server",4.5,Data Base Administrator
Algosec,"DBA, India",Delhi,0.0,"Software troubleshooting, Disaster recovery, English, Java, Databases",4.3,Data Base Administrator
DXC Technology,Senior SQL Server DBA,Bengaluru,554000.0,"Encryption, Microsoft SQL Server, Databases, SQL, PowerShell",3.5,Data Base Administrator
Oracle,Sr Oracle Apps DBA,Bengaluru,627500.0,"Cloud infrastructure, Oracle, English, SQL, PL/SQL",3.8,Data Base Administrator
Logicsoft International,PostgreSQL DBA,Delhi,0.0,"SQL, Database administration, PostgreSQL",3.3,Data Base Administrator
Anvin Infosystems Palakkad,SQL Developer,India,0.0,"Performance tuning, CSS, Database development, Relational databases, Microsoft SQL Server",,Data Base Administrator
MNJ Software,Team Member (Oracle DBA),Remote,0.0,"Oracle, Data structures, Microsoft SQL Server, English, Administrative experience",3.6,Data Base Administrator
Ameriprise India,Technical Lead - Database Analyst,Noida,630000.0,"Performance tuning, Microsoft SQL Server, SQL, Database design, Database administration",3.8,Data Base Administrator
Parexel,"Senior Database Administrator, IT Enterprise",Hyderābād,792500.0,"Performance tuning, System administration, Oracle, IT management, XML",4.0,Data Base Administrator
Infolob Solutions,Oracle DBA,Mumbai,3360000.0,"Performance tuning, Oracle, Encryption, Windows, Databases",4.3,Data Base Administrator
Jade Global,SQL Server DBA,Hyderābād,508500.0,"Performance tuning, Cloud infrastructure, Node.js, Encryption, Disaster recovery",3.7,Data Base Administrator
LSEG (London Stock Exchange Group),Sr. Database Engineer,Bengaluru,729000.0,"CI/CD, Performance tuning, Azure, DevOps, Encryption",3.8,Data Base Administrator
Rightpath Computer Technologies,ORACLE DBA,Hyderābād,615000.0,"Oracle, Weblogic, OBIEE",4.6,Data Base Administrator
MBI Digital,Oracle DBA with Golden Gate,India,0.0,"Performance tuning, Oracle, Remedy, Database development, MongoDB",2.9,Data Base Administrator
Triumph Ladders Pvt. Ltd.,Cassandra dba,Bengaluru,600000.0,"Cassandra, Software troubleshooting, Encryption, Python",5.0,Data Base Administrator
NTT DATA,Oracle DBA,Bengaluru,584000.0,"Oracle, Ansible, Databases, SQL, Analysis skills",3.8,Data Base Administrator
Conacent Consulting,Oracle Core DBA,Calcutta,437000.0,Oracle,3.9,Data Base Administrator
Valley Telegence,Database Architect/ Engineer,Gurgaon,0.0,"Oracle, Database administration, Scripting, Linux, Shell Scripting",1.0,Data Base Administrator
SSTech System Solutions,SQL DBA,Gujarat,0.0,"Microsoft SQL Server, SQL, Business development, Organizational skills, Communication skills",3.9,Data Base Administrator
SecureKloud,"Snowflake DBA with Snowflake,SQL,Performance Tuning Pune (Hybrid)",Chennai,505000.0,"SQL, Accounting",3.8,Data Base Administrator
HIPAA box Inc.,DBA,Pune,503500.0,"Oracle, XML, SQL, Database administration, AWS",2.7,Data Base Administrator
Phygital Insights,Sybase Database Admin,Bengaluru,600000.0,"Oracle, Microsoft SQL Server, SQL, Sybase, High availability",4.9,Data Base Administrator
AWC Consulting,Oracle DBA,Delhi,0.0,"Operating systems, Oracle, Solaris, Windows, Database administration",,Data Base Administrator
Equinix,Senior Staff App and Database Administrator (Siebel),Bengaluru,470000.0,"Jira, CI/CD, Pricing, Oracle, CSS",4.0,Data Base Administrator
MNJ Software,Lead MongoDB Database Administrator,Remote,0.0,"Big data, NoSQL, English, MongoDB, Java",3.6,Data Base Administrator
Pi Techniques,Mongo DBA,Mumbai,522000.0,"Cassandra, Software troubleshooting, Kubernetes, Encryption, NoSQL",3.1,Data Base Administrator
SAP,Senior Database Administrator - SAP HANA,Bengaluru,775000.0,"Azure, Ansible, SAP HANA, DB2, SAP",4.2,Data Base Administrator
SSquad Global,Oracle Apps DBA Consultant,Bengaluru,480000.0,"Cloud infrastructure, Oracle, Cloud architecture, Software troubleshooting, Oracle EBS",4.2,Data Base Administrator
Atlas Systems,SQL DBA-HR-P1,Bengaluru,554000.0,"Performance tuning, Azure, Oracle, Encryption, Disaster recovery",4.0,Data Base Administrator
Yaanar Technologies Pvt Ltd,Oracle Apps DBA,Chennai,0.0,"Performance tuning, Cloud infrastructure, Oracle, Software troubleshooting, DevOps",,Data Base Administrator
Ajaysai Solutions Pvt Ltd,DB2 DBA,Bengaluru,1195500.0,"Oracle, DB2, Microsoft SQL Server, SQL, Database design",,Data Base Administrator
MNJ Software,PostgreSQL DBA,Remote,0.0,"English, Databases, Administrative experience, SQL, Database administration",3.6,Data Base Administrator
Nuware Systems,Snowflake DBA,Bengaluru,710000.0,"Microsoft SQL Server, SQL, Communication skills",4.2,Data Base Administrator
Onedirect,Database Engineer - DBA,Bengaluru,0.0,"Elasticsearch, Azure, Cassandra, Relational databases, NoSQL",3.6,Data Base Administrator
InnOvator Web Solutions,Cassandra DBA,India,0.0,"Microsoft Access, Cassandra, Spark, NoSQL, Java",3.2,Data Base Administrator
Logitech,Database Engineer,Chennai,587500.0,"Hyperion, Oracle, Pentaho, Microsoft SQL Server, Oracle EBS",4.2,Data Base Administrator
Conacent Consulting,Oracle Apps DBA,Calcutta,437000.0,Oracle,3.9,Data Base Administrator
Agnito Technologies,Senior Database Architect,Bhopal,0.0,"Software troubleshooting, NoSQL, MongoDB, Databases, SQL",,Data Base Administrator
Galaxy Office Automation,Oracle DBA,Thāne,610000.0,"Performance tuning, System administration, Oracle, Node.js, Ansible",4.2,Data Base Administrator
Saankhya,Oracle Apps DBA,Maharashtra,0.0,"Oracle, Software troubleshooting",5.0,Data Base Administrator
PayU,Lead- MYSQL DBA,Gurgaon,532500.0,"Performance tuning, Cassandra, Software troubleshooting, MongoDB, SQL",3.7,Data Base Administrator
Helius Technologies,Product DBA,India,0.0,"CI/CD, Power BI, Database development, Software deployment, DevOps",4.2,Data Base Administrator
Ahana Systems and Solutions,MySQL DBA,Bengaluru,3714000.0,"Data modeling, Disaster recovery, SQL, Scripting, PowerShell",4.4,Data Base Administrator
