company_name,job_role,job_location,salary_pa,skills,company_rating,standardized_job_role
Knack Consulting Services Pvt Ltd,Senior DBA,Bengaluru,0.0,"Performance tuning, Database administration, Analysis skills, PostgreSQL",3.8,Data Base Administrator
Simple Logic IT,Oracle DBA Performance Tuning,Mumbai,3990000.0,"Cloud infrastructure, Oracle, SQL, Scripting, PL/SQL",4.2,Data Base Administrator
Paytm,MySQL DBA-Paytm Money-Paytm Money,Noida,373500.0,"Performance tuning, Cloud infrastructure, Microsoft SQL Server, MongoDB, Databases",3.2,Data Base Administrator
CDM Smith,Senior Database Administrator (Digital Engineering Solutions),Chennai,497500.0,"CI/CD, Authentication, Cloud infrastructure, Azure, MVC",4.1,Data Base Administrator
Blazeclan Technologies,Database Admin L3 - Aurora DB,Bengaluru,0.0,"SQL, Database administration, AWS, ITIL, PostgreSQL",3.8,Data Base Administrator
Kāladi Consulting,Oracle Apps DBA,Bengaluru,528500.0,"Oracle, Oracle EBS, Weblogic, Databases, SQL",3.8,Data Base Administrator
RSAB IT India,ORACLE DBA,Bengaluru,600000.0,"Performance tuning, Oracle, Database administration, Communication skills",3.8,Data Base Administrator
Amrita University,Alumni Engagement Database Administrator & E-mail Marketing Specialist (Basic level),Kollam,495000.0,"Email marketing, Project management, SEO, Marketing automation, Google Analytics",3.9,Data Base Administrator
Kontoor Brands,"Senior System Engineer, Database Administration",Remote,0.0,"Microsoft Windows Server, SFTP, Power BI, TCP, Cloud infrastructure",3.5,Data Base Administrator
Exela Technologies,Sr.DBA,Pune,473500.0,"Microsoft SQL Server, SQL",3.6,Data Base Administrator
Maxus Technologies,SQL Developer/Sr. SQL Developer,India,0.0,"Software troubleshooting, Database development, Microsoft SQL Server, SSRS, Databases",4.5,Data Base Administrator
Access Automation,System Admin with SQL DBA,Bengaluru,542000.0,"Microsoft Windows Server, IIS, LAN, Microsoft SQL Server, Windows",3.0,Data Base Administrator
Kyndryl,REDIS DB DBA,Mumbai,628000.0,"Microsoft Windows Server, Cloud infrastructure, Azure, Windows, SQL",3.9,Data Base Administrator
CAI,SQL and Oracle DBA,Remote,0.0,"Azure, Oracle, SCCM, Ansible, Vendor management",3.2,Data Base Administrator
Genpact,Lead Consultant - MS SQL DBA,Hyderābād,806500.0,"Microsoft SQL Server, SQL, Communication skills",3.9,Data Base Administrator
Motive,Senior Database Engineer (DBA),Bengaluru,725000.0,"Elasticsearch, Ansible, Databases, Database administration, AWS",4.0,Data Base Administrator
i-Source Infosystems,PeopleSoft DBA,Pune,350000.0,"SQL, Database administration, PeopleSoft",3.3,Data Base Administrator
Rightpath Computer Technologies,ORACLE APPS DBA,Hyderābād,615000.0,Oracle,4.6,Data Base Administrator
Nascent Infotechnologies,Postgresql DBA,Ahmedabad,0.0,"Windows, SQL, PostgreSQL, Linux, Debugging",,Data Base Administrator
IT Convergence,Oracle Apps DBA,Hyderābād,4440000.0,"Cloud infrastructure, Oracle, Oracle EBS, Windows, AWS",3.9,Data Base Administrator
Viavi Solutions,Database Engineer,Chennai,509000.0,"Oracle, Node.js, Cassandra, Big data, Spark",3.7,Data Base Administrator
Virtusa,Oracle DBA,Chennai,987500.0,"Oracle, MongoDB, SQL, Linux, PL/SQL",3.7,Data Base Administrator
Capgemini,"SQL Server DBA | 9 to 12 Years | Bengaluru, Pune & Mumbai",Bengaluru,632500.0,"Disaster recovery, Microsoft SQL Server, ServiceNow, AI, Communication skills",3.8,Data Base Administrator
United Airlines,Senior Manager - Database Engineering and Operations,Gurgaon,2238000.0,"Cloud infrastructure, Oracle, Management, Microsoft SQL Server, NoSQL",3.9,Data Base Administrator
Phygital Insights,Oracle Database Administration,Chennai,505000.0,"Oracle, Microsoft SQL Server, MongoDB, Database administration, PostgreSQL",4.9,Data Base Administrator
Varseno Solutions,Sr. SQL Developer,India,0.0,"Microsoft Windows Server, TCP, Relational databases, Microsoft SQL Server, SSRS",4.7,Data Base Administrator
Zensar Technologies,ESaaS - Oracle - DBA - Apps,Maharashtra,0.0,"Oracle, Remedy, IT service management, Microsoft SQL Server, SQL",3.9,Data Base Administrator
Xanika Infotech,Application DBA Lead,Chennai,1000000.0,"Oracle, J2EE, Java, Microservices, SOAP",4.0,Data Base Administrator
Varologic,Sr. Microsoft SQL DBA,Ahmedabad,463500.0,"Hyperion, Oracle, IIS, Microsoft SQL Server, SSRS",4.1,Data Base Administrator
ExcelaCom Technologies,Oracle DBA,Chennai,0.0,"Oracle, Database design, AWS, Agile",3.4,Data Base Administrator
MSC Technology,SENIOR DBA - SQL,Chennai,387000.0,"Performance tuning, Azure, Microsoft SQL Server, SSRS, SQL",3.2,Data Base Administrator
Excelencia Itech Consulting Pvt Ltd,SQL DBA,Chennai,402500.0,"Performance tuning, Azure, Encryption, Microsoft SQL Server, SQL",4.5,Data Base Administrator
Savitriya Technologies,DBA Genius (DBA / SDBA),Ahmedabad,0.0,"Perl, Scripting, MySQL",4.1,Data Base Administrator
E Hook Systems,SQL DBA,Delhi,0.0,"Microsoft Windows Server, Performance tuning, Oracle, Business intelligence, Microsoft SQL Server",,Data Base Administrator
LiferayGurus,Lead Engineer/DBA (MySQL) India,India,0.0,"Databases, Hibernate, MySQL",,Data Base Administrator
Gtropy Systems,SQL DEVELOPER – DBA,Delhi,0.0,"ASP.NET, Relational databases, Microsoft SQL Server, SQL, Database design",4.4,Data Base Administrator
Jade Global,SQL DBA,Hyderābād,508500.0,"SQL, Communication skills",3.7,Data Base Administrator
Paytm,DBA - Senior MySQL DBA,Noida,373500.0,"AWS, Terraform, MySQL",3.2,Data Base Administrator
Comcast Corporation,Engineer 3 - Database Administration,Chennai,535000.0,Database administration,3.8,Data Base Administrator
Cintra: The Multi-Cloud Database Architects,EBS DBA,Chandigarh,434500.0,"Oracle, Oracle EBS, Google Cloud Platform, Database administration, AWS",3.8,Data Base Administrator
SAP,SAP HANA and ASE Database Engineer (1-3 years experience only),Bengaluru,829500.0,"Azure, Oracle, SAP HANA, DB2, SAP",4.2,Data Base Administrator
State Street,"Lead Database Performance Engineer, Officer",Hyderābād,628000.0,"Performance tuning, Power BI, Cloud infrastructure, Azure, Customer service",3.5,Data Base Administrator
DXC Technology,Sr Analyst II Infrastructure Services (Database),Bengaluru,510000.0,"Performance tuning, Cloud infrastructure, Operating systems, Oracle, Microsoft SQL Server",3.5,Data Base Administrator
Bloom Solutions Pvt. Ltd.,Oracle Apps DBA,Hyderābād,0.0,"Performance tuning, Oracle, ERP systems, Oracle EBS, Databases",4.3,Data Base Administrator
TransUnion,Consultant MariaDB DBA,Pune,849500.0,"Databases, SQL, PHP, Scripting, Recruiting",4.0,Data Base Administrator
Evolent Health,"Analyst, Provider Data Management",Pune,247000.0,"Microsoft Powerpoint, Visual Basic, Microsoft SQL Server, Analysis skills, Organizational skills",3.4,Data Base Administrator
Kaleyra,DBA Engineer (Remote) #243,Bengaluru,535000.0,"MongoDB, Databases, SQL, AWS, Perl",3.9,Data Base Administrator
E Hook Systems,DB2 DBA,Delhi,0.0,"Performance tuning, Data modeling, Remedy, DB2, Database design",,Data Base Administrator
UST Global,Lead SQL Administrator with T-SQL and Powershell,Thiruvananthapuram,890000.0,"CI/CD, Performance tuning, Azure, Encryption, Disaster recovery",3.9,Data Base Administrator
Vodafone,"Assistant Manager_Oracle DBA, Datagaurd_Pune",Pune,505500.0,"Performance tuning, Oracle, Business intelligence, Cassandra, NoSQL",3.9,Data Base Administrator
Retail Sols,DBA - Oracle Retail,Hyderābād,565000.0,"Oracle, Weblogic, Communication skills",2.6,Data Base Administrator
Oracle,Senior DevOps Engineer - Autonomous Database,India,0.0,"Cloud infrastructure, Oracle, OS Kernels, APIs",3.8,Data Base Administrator
Oracle,Principal DevOps Engineer - Autonomous Database,India,0.0,"Cloud infrastructure, Oracle, Software troubleshooting, Java, OS Kernels",3.8,Data Base Administrator
LSEG (London Stock Exchange Group),Database & DevOps Engineer,Bengaluru,800000.0,"Data modeling, Cloud infrastructure, System administration, Ansible, Relational databases",3.8,Data Base Administrator
Dassault Systèmes,Snowflake SQL Developer,Pune,700000.0,"NoSQL, SQL, Unit testing, Debugging",4.0,Data Base Administrator
Worldpay,Database Developer(7+ years of experiencein PL/SQL) Pune,Pune,800000.0,"Performance tuning, Oracle, SQL, Agile, PL/SQL",3.9,Data Base Administrator
Classic Informatics Private Limited,Database Administrator,Gurgaon,600000.0,"Ansible, Encryption, MongoDB, SQL, Database administration",4.4,Data Base Administrator
Capital Placement Services,SQL Database Administrator For MNC in Spaze IT Park Gurgaon,Farīdābād,600000.0,"Performance tuning, Microsoft Excel, Data analysis skills, Disaster recovery, Microsoft SQL Server",,Data Base Administrator
DTCC,Data Management Associate Director,Chennai,4800000.0,"Jira, Data modeling, Kanban, SQL, Database design",3.8,Data Base Administrator
Tech Concierge Pro,MySQL DBA,Remote,1550000.0,"Performance tuning, Encryption, Disaster recovery, Google Cloud Platform, SQL",,Data Base Administrator
Koenig Solutions Pvt. Ltd,Corporate Trainer - SQL Database,Remote,720000.0,"Azure, Oracle, Microsoft SQL Server, SQL, AWS",3.7,Data Base Administrator
Mobineers Info Systems,SQL Developer,India,0.0,"Microsoft SQL Server, SQL",3.8,Data Base Administrator
NCR JOB CONSULTANT,Network Engineer (Broadband),Karol Bāgh,360000.0,"Operating systems, English, Network protocols, Routing protocols, Computer networking",,Data Base Administrator
Genesis Head Hunters,Field Network Engineer (Broadband),Bengaluru,3960000.0,"Software troubleshooting, Field sales, Network engineering",5.0,Data Base Administrator
Vodafone,"Assistant Manager_Senior Engineer_Unix, SQL-PL- SQL- DWH_Pune",Pune,450000.0,"Business intelligence, SAS, SQL, Problem management, PL/SQL",3.9,Data Base Administrator
Google,Databases Engineer,Bengaluru,0.0,"Data modeling, Oracle, Software troubleshooting, Encryption, NoSQL",4.3,Data Base Administrator
Mastercard,Software Engineer-II (PL/SQL),Vadodara,700000.0,"Oracle, JUnit, Database development, Git, Test-driven development",4.2,Data Base Administrator
State Street,"Lead Database Performance Engineer, Officer",Hyderābād,650000.0,"Performance tuning, Power BI, Cloud infrastructure, Azure, Customer service",3.5,Data Base Administrator
Photon,"Software Engineer-Java, SQL",Chennai,550000.0,"Java, Microservices, SQL, REST, APIs",4.0,Data Base Administrator
