company_name,job_role,job_location,salary_pa,skills,company_rating,standardized_job_role
Saraswati MG Groups,IT Support Executive,Jalgaon,168000.0,"Software troubleshooting, LAN, Microsoft Office, ServiceNow, Linux",,IT Specialist
Juvenca Online Pvt Ltd,IT Administrator,India,306000.0,"Computer science, Azure, Operating systems, Software troubleshooting, IT",2.6,IT Specialist
Accenture,Application Tech Support Practitioner,Pune,0.0,"Technical support, Analysis skills, Communication skills",3.8,IT Specialist
Rajat Buildtech Pvt. Ltd.,IT Administrator,India,300000.0,"English, Microsoft Office, IT",,IT Specialist
Ceragon,IT Helpdesk Representative,Bengaluru,4800000.0,"TCP, Software troubleshooting, SCCM, Customer service, Encryption",4.0,IT Specialist
Unisys,IT Asset Management (ITAM) – IT Specialist 2,Bengaluru,550000.0,"Asset management, Management, Java, Continuous improvement, JavaScript",3.6,IT Specialist
PATTAMBI INVESTMENTS AND LOANS PRIVATE LIMITED,IT Support Officer,Thrissur,126000.0,"English, Microsoft Office, ServiceNow",,IT Specialist
SBMB Projects Pvt Ltd,IT Support,India,0.0,"Power BI, Microsoft Excel, LAN, Tableau, Java",,IT Specialist
Elite Technocrats,IT Support Manager / Executive,Surat,550000.0,"Microsoft Word, Microsoft Excel, Microsoft Outlook, Operations management, Microsoft Office",2.3,IT Specialist
Bitla Software Pvt Ltd,Tech Support Executive,India,1224000.0,"Customer service, English, Technical support, Microsoft Office, Hindi",4.0,IT Specialist
THE RRKS,IT Helpdesk Technician,Andhāri,350000.0,"Software troubleshooting, Customer service, Analysis skills, Cybersecurity, Communication skills",,IT Specialist
SAG Infotech,Tech Support 0-2 Years,Jaipur,1200000.0,"Desktop support, Technical support, Communication skills",4.0,IT Specialist
XL Dynamics India,IT Helpdesk Executive,Navi Mumbai,400000.0,"Operating systems, Software troubleshooting, LAN, Windows, Microsoft Office",2.8,IT Specialist
ATSPL - Maharashtra - C56,IT Support Associate II,Mumbai,600000.0,"Customer service, Windows, AWS, IT support, Linux",3.6,IT Specialist
Rupeeseed Technology Ventures,Tech Support,Nashik,550000.0,"Software deployment, Technical support, Functional testing, SQL, Software development",3.9,IT Specialist
Lummus Technology,IT Specialist II - Sales Force Administrator,Gurgaon,550000.0,"Salesforce, E-Commerce, Data management, Communication skills",3.7,IT Specialist
Accenture,Infra Tech Support Practitioner,Nāgpur,0.0,"Software troubleshooting, Technical support, Computer networking",3.8,IT Specialist
M/s. Prerana Motors Pvt Ltd,Executive IT Support,Bengaluru,288000.0,"Microsoft Windows Server, Tally, Software troubleshooting, SAP, Accounting software",,IT Specialist
Panacea Healthcare Management,IT Technician,Ahmedabad,2880000.0,"EPA, CCTV, Microsoft Office, Electrical experience, Computer networking",4.0,IT Specialist
Plasma Computing Group,IT Help Desk Executive,Noida,450000.0,"LAN, IT, Help desk",4.1,IT Specialist
Innovative insightt,Tech Support Voice,India,350000.0,"English, Technical support, Hindi",,IT Specialist
Flight Simulation Technique Centre,Sr./Executive - IT Support,Gurgaon,0.0,"Software troubleshooting, Microsoft Office, Computer skills",3.1,IT Specialist
Bathiya & Associates LLP,IT Support Required Bathiya & Associates LLP -Andheri east,India,3024000.0,"Software troubleshooting, LAN, Windows, Active Directory, VPN",4.2,IT Specialist
Aishwarya Fish Acquarium,IT Support Technician,Jāmnagar,240000.0,"Organizational skills, AI",,IT Specialist
Helius Technologies,LEAD IT SUPPORT,India,0.0,"TCP, Software deployment, English, Project management, Computer networking",4.2,IT Specialist
ADCI - Tamil Nadu,"Specialist, Quality Services, Device Tech Support",Chennai,500000.0,"Technical support, Communication skills",3.6,IT Specialist
Travarsa,IT Help Desk Technician,Pune,3000000.0,"Software troubleshooting, Communication skills, Help desk, Mobile devices",5.0,IT Specialist
HRCONNECT CONSULTANCY SERVICES PTE LTD,Digital Transformation/IT Support,Chennai,0.0,"Software troubleshooting, Linux, Communication skills",,IT Specialist
FTC Solar Inc.,IT Security & Compliance Administrator,Bengaluru,1600000.0,"Azure, IT auditing, English, SOX, Microsoft Office",,IT Specialist
Easy Solution,IT Support Executive/Telecaller,Delhi,0.0,Communication skills,5.0,IT Specialist
Ducem Technologies Private Limited,IT Administrator,Dahej,450000.0,"ERP systems, Project management, Leadership, Communication skills",,IT Specialist
Marken,IT Service Desk Analyst - L1,Maharashtra,0.0,"Azure, Operating systems, Software troubleshooting, Customer service, English",2.8,IT Specialist
Pradhan Mercantile Pvt Ltd,IT Administrator,India,210000.0,"Computer science, Azure, Operating systems, Software troubleshooting, IT",,IT Specialist
Genesis HR Services,IT Support,Pune,300000.0,"English, Technical support, DNS, ServiceNow, Communication skills",,IT Specialist
Easebuzz Pvt Ltd,Tech Support,Calcutta,450000.0,"Software troubleshooting, Technical support, Software development, APIs, SDLC",3.1,IT Specialist
You Broadband,IT Help Desk,India,0.0,"TCP, Microsoft Outlook, Customer service, LAN, Windows",3.4,IT Specialist
AccorCorpo,IT Service Desk Manager,Gurgaon,0.0,Help desk,3.9,IT Specialist
Mind map IT Solutions,IT Support Services Specialist,Mohali,300000.0,"Operating systems, Microsoft Office, Firewall, IT support, ServiceNow",,IT Specialist
A.R.S Arm of India,IT Administrator in School,Noida,270000.0,"Windows, Firewall, Analysis skills, Computer hardware, Network protocols",,IT Specialist
Gambit,IT Support Executive,Rājkot,240000.0,"English, Microsoft Office, Analysis skills, ServiceNow, SEM",,IT Specialist
Team Computers,IT Service Delivery Specialist,Delhi,0.0,"Cloud infrastructure, System administration, Azure, PaaS, AWS",4.0,IT Specialist
YDigital,Junior IT Technician,India,150000.0,"English, Microsoft Office, ServiceNow",,IT Specialist
Mind map IT Solutions,IT Support Manager,Kharar,318000.0,"Software troubleshooting, Windows, Technical support, IT support, Help desk",,IT Specialist
PairSoft,Senior IT Security Administrator,Remote,2400000.0,"Oracle, Software troubleshooting, PCI, IIS, Visual Basic",4.0,IT Specialist
ADCI - Tamil Nadu,"Associate, Quality Services, Device Tech Support",Chennai,4200000.0,"Technical support, Agile, Root cause analysis",3.6,IT Specialist
Vardaam Web Solutions Pvt. Ltd.,Tech Support,Vadodara,2160000.0,"English, Technical support, Linux, Communication skills",4.5,IT Specialist
Fourth Dimension Technologies Pvt. Ltd,IT Helpdesk Coordinator,India,3000000.0,"Microsoft Powerpoint, Microsoft Excel, Microsoft Office, ServiceNow, Help desk",4.3,IT Specialist
TechUnity Software Systems India Pvt Ltd,Level 1/Level 2 Tech Support - Windows Administrator,Coimbatore,1000000.0,"Microsoft Windows Server, Software troubleshooting, Disaster recovery, Windows, Technical support",4.1,IT Specialist
BBS,IT Specialist- Commvault,Gurgaon,4800000.0,"Microsoft Windows Server, Oracle, NFS, SAP, LAN",4.0,IT Specialist
symplr,IT Help Desk Engineer,Bengaluru,350000.0,"Azure, Software troubleshooting, Enterprise Software, iOS, Microsoft Exchange",3.4,IT Specialist
DextrousD Technovation Pvt Ltd,IT Helpdesk Support,India,120000.0,"Software troubleshooting, Customer service, Windows, Microsoft Office, IT support",,IT Specialist
Dhrupad Technologies,IT Helpdesk Associate,India,720000.0,"English, Microsoft Office, Communication skills",4.6,IT Specialist
SS&C,IT Support - Contract Staff,Navi Mumbai,500000.0,IT support,3.1,IT Specialist
Chromatic Infosystems,IT HELPDESK EXECUTIVE,India,0.0,LAN,,IT Specialist
Xpert Times,IT Help Desk Technician,Delhi,0.0,"English, Databases, Customer support, Communication skills, Help desk",,IT Specialist
Conneqt Business Solutions,Tech Support Executive,Bengaluru,336000.0,"Technical support, Microsoft Office, ServiceNow, Typing",,IT Specialist
MoEngage Inc,IT Administrator,Bengaluru,700000.0,"Jira, Software troubleshooting, Big data, Windows, Information security",4.1,IT Specialist
Diginsta,Tech Support Executive,Bengaluru,336000.0,"Technical support, Microsoft Office, ServiceNow, Typing",,IT Specialist
Wissen InfoTech,IT Service Desk Analyst,Bengaluru,4800000.0,Communication skills,3.7,IT Specialist
Xxat Solution,Tech Support,Raipur,500000.0,"Technical support, Communication skills",,IT Specialist
Onex Solutions Pvt Ltd,Tech Support,India,270000.0,"Technical support, Microsoft Office, APIs, ServiceNow",3.0,IT Specialist
RoadCast,Tech Support,Delhi,0.0,Technical support,4.0,IT Specialist
Swathi Business Solutions,IT ADMINISTRATOR,India,0.0,"Cloud infrastructure, Operating systems, Software troubleshooting, Google Cloud Platform, Firewall",4.0,IT Specialist
Guardian management services,IT Administrator -6-9yrs exp.,India,480000.0,"Network installation, TCP, Azure, C#, Windows",,IT Specialist
Mind map IT Solutions,IT Service Desk Support Executive,Mohali,350000.0,"Software troubleshooting, Microsoft Office, ServiceNow",,IT Specialist
Bosch Group,IN_RBAI_Senior Engineer-Production IT Support,Bengaluru,4800000.0,"SQL, C++, C, Continuous integration, Agile",4.1,IT Specialist
Firststep Placement Services,IT Engineer,Bengaluru,990000.0,"Microsoft Office, Project management, ServiceNow",,IT Specialist
Larsen & Toubro,IT Engineer,Vadodara,1250000.0,"Microsoft Windows Server, 2D animation, Oracle, .NET Core, Windows",3.4,IT Specialist
Kapoor and Associates,IT Engineer,Delhi,330000.0,"English, Microsoft Office, ServiceNow, Hindi",,IT Specialist
Eon Group,IT Engineer,Gurgaon,0.0,"Network administration, SSO, Operating systems, Software troubleshooting, IT service management",,IT Specialist
Maruti Suzuki India Ltd,IT Infrastructure Projects Execution,India,0.0,"LAN, Project management, Communication skills",3.8,IT Specialist
Liebherr-Appliances India Private Limited,IT Infra Engineer,Aurangābād,650000.0,"ERP systems, LAN, WAN, MPLS, VMWare",3.8,IT Specialist
JMAN Group,IT Infrastructure Engineer,Chennai,600000.0,"Operating systems, Windows, Technical support, Microsoft Office, IT support",3.8,IT Specialist
Network Techlab (India) Pvt. Ltd,IT Engineer,India,540000.0,"TCP, Azure, Incident management, Customer service, Firewall",3.8,IT Specialist
DigiValet,System IT Engineer,Indore,400000.0,"Hospitality, TCP, Tally, Software troubleshooting, LAN",3.0,IT Specialist
Mouser Electronics,IT Security System Administrator III,Bengaluru,950000.0,"Azure, Operating systems, Windows, Information security, Java",3.8,IT Specialist
Ujjivan Small Finance Bank,Credit Manager,India,0.0,Underwriting,3.4,IT Specialist
Swiggy,Deputy Unit Manager View Jobs,Hyderābād,750000.0,Management,3.6,IT Specialist
Staff4Me,IT security JR engineer,Pune,0.0,"Operating systems, Information security, Firewall, Analysis skills, IDS",,IT Specialist
Dicetek LLC,"Senior Engineer , IT Security Operations – Firewall",Remote,0.0,"TCP, Software troubleshooting, OOP, Firewall, Analysis skills",4.3,IT Specialist
OMH HealthEdge Holdings,SENIOR ENGINEER - IT SECURITY,Coimbatore,600000.0,"TCP, Software troubleshooting, OSPF, Network infrastructure, Firewall",4.0,IT Specialist
Qualcomm,Storage & Backup Engineer (IT Engineer),Bengaluru,700000.0,"Azure, Oracle, Ansible, Disaster recovery, Solaris",3.9,IT Specialist
Accenture,Application Tech Support Practitioner,Bengaluru,0.0,"Software troubleshooting, Kubernetes, Technical support, Docker, Scripting",3.8,IT Specialist
Qualcomm,Senior IT Engineer (Desktop Field Services),Bengaluru,1000000.0,"Desktop support, Customer service, LAN, Laboratory experience, Windows",3.9,IT Specialist
